Image_Names,Card_ID,Card_Name,Super_Type,Types,Set_Name,Number,Rarity,Large_Image_URL,Small_Image_URL,HP,Abilities,Attacks_JSON,Attack_Names,Attack_Damages,Attack_Texts,Weaknesses,Resistances,Retreat_Cost,Evolves_From,Artist,FlavorText,Normal_low,Normal_mid,Normal_high,Normal_market,Normal_directLow,Holofoil_low,Holofoil_mid,Holofoil_high,Holofoil_market,Holofoil_directLow,ReverseHolofoil_low,ReverseHolofoil_mid,ReverseHolofoil_high,ReverseHolofoil_market,ReverseHolofoil_directLow,FirstEditionHolofoil_low,FirstEditionHolofoil_mid,FirstEditionHolofoil_high,FirstEditionHolofoil_market,FirstEditionHolofoil_directLow,FirstEditionNormal_low,FirstEditionNormal_mid,FirstEditionNormal_high,FirstEditionNormal_market,FirstEditionNormal_directLow
000.jpg,xy10-1,Shuckle,Pokémon,Grass,Fates Collide,1,Uncommon,https://images.pokemontcg.io/xy10/1_hires.png,https://images.pokemontcg.io/xy10/1.png,80,,"[{""name"": ""Hide a Berry"", ""cost"": [""Colorless""], ""convertedEnergyCost"": 1, ""damage"": """", ""text"": ""Draw 2 cards. Then, put a card from your hand on the bottom of your deck.""}, {""name"": ""Wrap"", ""cost"": [""Colorless"", ""Colorless""], ""convertedEnergyCost"": 2, ""damage"": ""30"", ""text"": ""Flip a coin. If heads, your opponent's Active Pokémon is now Paralyzed.""}]",Hide a Berry|Wrap,|30,"Draw 2 cards. Then, put a card from your hand on the bottom of your deck.|Flip a coin. If heads, your opponent's Active Pokémon is now Paralyzed.",Fire:×2,,Colorless,,sui,"It stores Berries inside its shell. To avoid attacks, it hides beneath rocks and remains completely still.",,,,,,,,,,,,,,,,,,,,,,,,,
001.jpg,xy10-2,Burmy,Pokémon,Grass,Fates Collide,2,Common,https://images.pokemontcg.io/xy10/2_hires.png,https://images.pokemontcg.io/xy10/2.png,60,,"[{""name"": ""Hang Down"", ""cost"": [""Colorless""], ""convertedEnergyCost"": 1, ""damage"": ""10"", ""text"": """"}]",Hang Down,10,,Fire:×2,,Colorless,,Kouki Saitou,"If its cloak is broken in battle, it quickly remakes the cloak with materials nearby.",,,,,,,,,,,,,,,,,,,,,,,,,
002.jpg,xy10-3,Wormadam,Pokémon,Grass,Fates Collide,3,Uncommon,https://images.pokemontcg.io/xy10/3_hires.png,https://images.pokemontcg.io/xy10/3.png,120,,"[{""name"": ""Solar Ray"", ""cost"": [""Grass""], ""convertedEnergyCost"": 1, ""damage"": ""20"", ""text"": ""Heal 20 damage from each of your Pokémon.""}, {""name"": ""Leaf Cutter"", ""cost"": [""Grass"", ""Colorless"", ""Colorless""], ""convertedEnergyCost"": 3, ""damage"": ""60+"", ""text"": ""Flip a coin. If heads, this attack does 30 more damage.""}]",Solar Ray|Leaf Cutter,20|60+,"Heal 20 damage from each of your Pokémon.|Flip a coin. If heads, this attack does 30 more damage.",Fire:×2,,Colorless__Colorless,Burmy,kawayoo,"When Burmy evolved, its cloak became a part of this Pokémon's body. The cloak is never shed.",,,,,,,,,,,,,,,,,,,,,,,,,
003.jpg,xy10-4,Mothim,Pokémon,Grass,Fates Collide,4,Rare,https://images.pokemontcg.io/xy10/4_hires.png,https://images.pokemontcg.io/xy10/4.png,90,"[{""name"": ""Wormadam First"", ""text"": ""As often as you like during your turn (before your attack), you may move 1 damage counter from 1 of your Wormadam to another of your Pokémon."", ""type"": ""Ability""}]","[{""name"": ""Gust"", ""cost"": [""Colorless"", ""Colorless"", ""Colorless""], ""convertedEnergyCost"": 3, ""damage"": ""60"", ""text"": """"}]",Gust,60,,Lightning:×2,Fighting:-20,,Burmy,MAHOU,It flutters around at night and steals honey from the Combee hive.,,,,,,,,,,,,,,,,,,,,,,,,,
004.jpg,xy10-5,Snivy,Pokémon,Grass,Fates Collide,5,Common,https://images.pokemontcg.io/xy10/5_hires.png,https://images.pokemontcg.io/xy10/5.png,60,,"[{""name"": ""Blot"", ""cost"": [""Grass""], ""convertedEnergyCost"": 1, ""damage"": ""10"", ""text"": ""Heal 10 damage from this Pokémon.""}]",Blot,10,Heal 10 damage from this Pokémon.,Fire:×2,,Colorless,,Atsuko Nishida,"They photosynthesize by bathing their tails in sunlight. When they are not feeling well, their tails droop.",,,,,,,,,,,,,,,,,,,,,,,,,
005.jpg,xy10-6,Servine,Pokémon,Grass,Fates Collide,6,Uncommon,https://images.pokemontcg.io/xy10/6_hires.png,https://images.pokemontcg.io/xy10/6.png,70,"[{""name"": ""Serpentine Strangle"", ""text"": ""When you play this Pokémon from your hand to evolve 1 of your Pokémon, you may flip a coin. If heads, your opponent's Active Pokémon is now Paralyzed."", ""type"": ""Ability""}]","[{""name"": ""Vine Whip"", ""cost"": [""Grass""], ""convertedEnergyCost"": 1, ""damage"": ""20"", ""text"": """"}]",Vine Whip,20,,Fire:×2,,Colorless,Snivy,Sumiyoshi Kizuki,"When it gets dirty, its leaves can't be used in photosynthesis, so it always keeps itself clean.",,,,,,,,,,,,,,,,,,,,,,,,,
006.jpg,xy10-7,Serperior,Pokémon,Grass,Fates Collide,7,Rare,https://images.pokemontcg.io/xy10/7_hires.png,https://images.pokemontcg.io/xy10/7.png,140,,"[{""name"": ""Coil"", ""cost"": [""Colorless""], ""convertedEnergyCost"": 1, ""damage"": ""40"", ""text"": ""During your next turn, this Pokémon's attacks do 60 more damage to your opponent's Active Pokémon (before applying Weakness and Resistance).""}, {""name"": ""Slashing Strike"", ""cost"": [""Grass""], ""convertedEnergyCost"": 1, ""damage"": ""80"", ""text"": ""This Pokémon can't use Slashing Strike during your next turn.""}]",Coil|Slashing Strike,40|80,"During your next turn, this Pokémon's attacks do 60 more damage to your opponent's Active Pokémon (before applying Weakness and Resistance).|This Pokémon can't use Slashing Strike during your next turn.",Fire:×2,,Colorless__Colorless,Servine,You Iribi,It can stop its opponents' movements with just a glare. It takes in solar energy and boosts it internally.,,,,,,,,,,,,,,,,,,,,,,,,,
007.jpg,xy10-8,Deerling,Pokémon,Grass,Fates Collide,8,Common,https://images.pokemontcg.io/xy10/8_hires.png,https://images.pokemontcg.io/xy10/8.png,60,,"[{""name"": ""Find a Friend"", ""cost"": [""Colorless""], ""convertedEnergyCost"": 1, ""damage"": """", ""text"": ""Search your deck for a Pokémon, reveal it, and put it into your hand. Shuffle your deck afterward.""}]",Find a Friend,,"Search your deck for a Pokémon, reveal it, and put it into your hand. Shuffle your deck afterward.",Fire:×2,,Colorless,,Kanako Eo,The turning of the seasons changes the color and scent of this Pokémon's fur. People use it to mark the seasons.,,,,,,,,,,,,,,,,,,,,,,,,,
008.jpg,xy10-9,Moltres,Pokémon,Fire,Fates Collide,9,Rare,https://images.pokemontcg.io/xy10/9_hires.png,https://images.pokemontcg.io/xy10/9.png,120,,"[{""name"": ""Combustion"", ""cost"": [""Fire""], ""convertedEnergyCost"": 1, ""damage"": ""20"", ""text"": """"}, {""name"": ""Flying Flare"", ""cost"": [""Fire"", ""Fire"", ""Colorless"", ""Colorless""], ""convertedEnergyCost"": 4, ""damage"": ""80+"", ""text"": ""You may do 40 more damage. If you do, this Pokémon does 20 damage to itself.""}]",Combustion|Flying Flare,20|80+,"|You may do 40 more damage. If you do, this Pokémon does 20 damage to itself.",Water:×2,Fighting:-20,Colorless,,OOYAMA,One of the legendary bird Pokémon. It is said that its appearance indicates the coming of spring.,,,,,,,,,,,,,,,,,,,,,,,,,
009.jpg,xy10-10,Fennekin,Pokémon,Fire,Fates Collide,10,Common,https://images.pokemontcg.io/xy10/10_hires.png,https://images.pokemontcg.io/xy10/10.png,60,,"[{""name"": ""Will-O-Wisp"", ""cost"": [""Fire""], ""convertedEnergyCost"": 1, ""damage"": ""10"", ""text"": """"}, {""name"": ""Tail Whip"", ""cost"": [""Colorless"", ""Colorless""], ""convertedEnergyCost"": 2, ""damage"": """", ""text"": ""Flip a coin. If heads, the Defending Pokémon can't attack during your opponent's next turn.""}]",Will-O-Wisp|Tail Whip,10|,"|Flip a coin. If heads, the Defending Pokémon can't attack during your opponent's next turn.",Water:×2,,Colorless,,Akira Komayama,"As it walks, it munches on a twig in place of a snack. It intimidates opponents by puffing hot air out of its ears.",,,,,,,,,,,,,,,,,,,,,,,,,
010.jpg,xy10-11,Fennekin,Pokémon,Fire,Fates Collide,11,Common,https://images.pokemontcg.io/xy10/11_hires.png,https://images.pokemontcg.io/xy10/11.png,50,,"[{""name"": ""Invite Out"", ""cost"": [""Colorless""], ""convertedEnergyCost"": 1, ""damage"": """", ""text"": ""Flip a coin. If heads, switch 1 of your opponent's Benched Pokémon with his or her Active Pokémon.""}]",Invite Out,,"Flip a coin. If heads, switch 1 of your opponent's Benched Pokémon with his or her Active Pokémon.",Water:×2,,Colorless,,kirisAki,"As it walks, it munches on a twig in place of a snack. It intimidates opponents by puffing hot air out of its ears.",,,,,,,,,,,,,,,,,,,,,,,,,
011.jpg,xy10-12,Braixen,Pokémon,Fire,Fates Collide,12,Uncommon,https://images.pokemontcg.io/xy10/12_hires.png,https://images.pokemontcg.io/xy10/12.png,80,,"[{""name"": ""Destructive Flame"", ""cost"": [""Fire""], ""convertedEnergyCost"": 1, ""damage"": ""20"", ""text"": ""Flip a coin. If heads, discard an Energy attached to your opponent's Active Pokémon.""}, {""name"": ""Crackling Ribbon"", ""cost"": [""Colorless"", ""Colorless""], ""convertedEnergyCost"": 2, ""damage"": ""30"", ""text"": """"}]",Destructive Flame|Crackling Ribbon,20|30,"Flip a coin. If heads, discard an Energy attached to your opponent's Active Pokémon.|",Water:×2,,Colorless,Fennekin,kirisAki,"When the twig is plucked from its tail, friction sets the twig alight. The flame is used to send signals to its allies.",,,,,,,,,,,,,,,,,,,,,,,,,
012.jpg,xy10-13,Delphox,Pokémon,Fire,Fates Collide,13,Rare Holo,https://images.pokemontcg.io/xy10/13_hires.png,https://images.pokemontcg.io/xy10/13.png,140,,"[{""name"": ""Flickering Flames"", ""cost"": [""Fire""], ""convertedEnergyCost"": 1, ""damage"": ""40"", ""text"": ""Your opponent's Active Pokémon is now Asleep.""}, {""name"": ""Psystorm"", ""cost"": [""Colorless"", ""Colorless"", ""Colorless""], ""convertedEnergyCost"": 3, ""damage"": ""20×"", ""text"": ""This attack does 20 damage times the amount of Energy attached to all Pokémon in play.""}]",Flickering Flames|Psystorm,40|20×,Your opponent's Active Pokémon is now Asleep.|This attack does 20 damage times the amount of Energy attached to all Pokémon in play.,Water:×2,,Colorless__Colorless,Braixen,Kagemaru Himeno,"Using psychic power, it generates a fiery vortex of 5,400 degree Fahrenheit, incinerating foes swept into this whirl of flame.",,,,,,,,,,,,,,,,,,,,,,,,,
013.jpg,xy10-14,Delphox BREAK,Pokémon,Fire,Fates Collide,14,Rare BREAK,https://images.pokemontcg.io/xy10/14_hires.png,https://images.pokemontcg.io/xy10/14.png,180,"[{""name"": ""Flare Witch"", ""text"": ""Once during your turn (before your attack), you may search your deck for a Fire Energy card and attach it to 1 of your Pokémon. Shuffle your deck afterward."", ""type"": ""Ability""}]",,,,,,,,Delphox,5ban Graphics,,,,,,,,,,,,,,,,,,,,,,,,,,
014.jpg,xy10-15,Seel,Pokémon,Water,Fates Collide,15,Common,https://images.pokemontcg.io/xy10/15_hires.png,https://images.pokemontcg.io/xy10/15.png,80,,"[{""name"": ""Icy Snow"", ""cost"": [""Water""], ""convertedEnergyCost"": 1, ""damage"": ""10"", ""text"": """"}]",Icy Snow,10,,Metal:×2,,Colorless__Colorless,,Hasuno,"Covered with light blue fur, its hide is thick and tough. It is active in bitter cold of -40 degrees Fahrenheit.",,,,,,,,,,,,,,,,,,,,,,,,,
015.jpg,xy10-16,Dewgong,Pokémon,Water,Fates Collide,16,Uncommon,https://images.pokemontcg.io/xy10/16_hires.png,https://images.pokemontcg.io/xy10/16.png,120,,"[{""name"": ""Freezing Breath"", ""cost"": [""Water""], ""convertedEnergyCost"": 1, ""damage"": ""20"", ""text"": ""Flip a coin. If heads, your opponent's Active Pokémon is now Paralyzed. If tails, your opponent's Active Pokémon is now Asleep.""}, {""name"": ""Aurora Beam"", ""cost"": [""Water"", ""Colorless"", ""Colorless"", ""Colorless""], ""convertedEnergyCost"": 4, ""damage"": ""100"", ""text"": """"}]",Freezing Breath|Aurora Beam,20|100,"Flip a coin. If heads, your opponent's Active Pokémon is now Paralyzed. If tails, your opponent's Active Pokémon is now Asleep.|",Metal:×2,,Colorless__Colorless__Colorless,Seel,Naoyo Kimura,"Its streamlined body has little drag in water. The colder the temperature, the friskier it gets.",,,,,,,,,,,,,,,,,,,,,,,,,
016.jpg,xy10-17,Omanyte,Pokémon,Water,Fates Collide,17,Uncommon,https://images.pokemontcg.io/xy10/17_hires.png,https://images.pokemontcg.io/xy10/17.png,80,,"[{""name"": ""Water Gun"", ""cost"": [""Water""], ""convertedEnergyCost"": 1, ""damage"": ""30"", ""text"": """"}]",Water Gun,30,,Grass:×2,,Colorless__Colorless,Helix Fossil Omanyte,Shigenori Negishi,"Revived from an ancient fossil, this Pokémon uses air stored in its shell to sink and rise in water.",,,,,,,,,,,,,,,,,,,,,,,,,
017.jpg,xy10-18,Omastar,Pokémon,Water,Fates Collide,18,Rare,https://images.pokemontcg.io/xy10/18_hires.png,https://images.pokemontcg.io/xy10/18.png,120,"[{""name"": ""Restoring Beam"", ""text"": ""Once during your turn (before your attack), you may search your deck for a Restored Pokémon and put it onto your Bench. Shuffle your deck afterward."", ""type"": ""Ability""}]","[{""name"": ""Spinning Attack"", ""cost"": [""Water"", ""Colorless""], ""convertedEnergyCost"": 2, ""damage"": ""60"", ""text"": """"}]",Spinning Attack,60,,Grass:×2,,Colorless__Colorless,Omanyte,Hasuno,"Once wrapped around its prey, it never lets go. It eats the prey by tearing at it with sharp fangs.",,,,,,,,,,,,,,,,,,,,,,,,,
018.jpg,xy10-19,Omastar BREAK,Pokémon,Water,Fates Collide,19,Rare BREAK,https://images.pokemontcg.io/xy10/19_hires.png,https://images.pokemontcg.io/xy10/19.png,140,"[{""name"": ""Dangerous Tentacle"", ""text"": ""Once during your turn (before your attack), you may switch 1 of your opponent's Benched Pokémon-EX with his or her Active Pokémon."", ""type"": ""Ability""}]",,,,,,,,Omastar,5ban Graphics,,,,,,,,,,,,,,,,,,,,,,,,,,
019.jpg,xy10-20,Glaceon-EX,Pokémon,Water,Fates Collide,20,Rare Holo EX,https://images.pokemontcg.io/xy10/20_hires.png,https://images.pokemontcg.io/xy10/20.png,170,,"[{""name"": ""Second Bite"", ""cost"": [""Water"", ""Colorless""], ""convertedEnergyCost"": 2, ""damage"": ""20+"", ""text"": ""This attack does 10 more damage for each damage counter on your opponent's Active Pokémon.""}, {""name"": ""Crystal Ray"", ""cost"": [""Water"", ""Colorless"", ""Colorless""], ""convertedEnergyCost"": 3, ""damage"": ""70"", ""text"": ""During your opponent's next turn, prevent all damage done to this Pokémon by attacks from Evolution Pokémon.""}]",Second Bite|Crystal Ray,20+|70,"This attack does 10 more damage for each damage counter on your opponent's Active Pokémon.|During your opponent's next turn, prevent all damage done to this Pokémon by attacks from Evolution Pokémon.",Metal:×2,,Colorless__Colorless,,Ayaka Yoshida,,,,,,,,,,,,,,,,,,,,,,,,,,
020.jpg,xy10-21,White Kyurem,Pokémon,Water,Fates Collide,21,Rare Holo,https://images.pokemontcg.io/xy10/21_hires.png,https://images.pokemontcg.io/xy10/21.png,130,,"[{""name"": ""Burning Icicles"", ""cost"": [""Water"", ""Colorless""], ""convertedEnergyCost"": 2, ""damage"": ""40"", ""text"": ""If this Pokémon has any Fire Energy attached to it, this attack does 20 damage to 2 of your opponent's Benched Pokémon. (Don't apply Weakness and Resistance for Benched Pokémon.)""}, {""name"": ""Blizzard Burn"", ""cost"": [""Water"", ""Water"", ""Colorless""], ""convertedEnergyCost"": 3, ""damage"": ""130"", ""text"": ""This Pokémon can't attack during your next turn.""}]",Burning Icicles|Blizzard Burn,40|130,"If this Pokémon has any Fire Energy attached to it, this attack does 20 damage to 2 of your opponent's Benched Pokémon. (Don't apply Weakness and Resistance for Benched Pokémon.)|This Pokémon can't attack during your next turn.",Metal:×2,,Colorless__Colorless__Colorless,,kawayoo,"It generates a powerful, freezing energy inside itself, but its body became frozen when the energy leaked out.",,,,,,,,,,,,,,,,,,,,,,,,,
021.jpg,xy10-22,Binacle,Pokémon,Water,Fates Collide,22,Common,https://images.pokemontcg.io/xy10/22_hires.png,https://images.pokemontcg.io/xy10/22.png,60,,"[{""name"": ""Swing Around"", ""cost"": [""Water"", ""Colorless""], ""convertedEnergyCost"": 2, ""damage"": ""10+"", ""text"": ""Flip 2 coins. This attack does 20 more damage for each heads.""}]",Swing Around,10+,Flip 2 coins. This attack does 20 more damage for each heads.,Grass:×2,,Colorless__Colorless,,Tomokazu Komiya,"They stretch and then contract, yanking their rocks along with them in bold hops. They eat seaweed that washes up on the shoreline.",,,,,,,,,,,,,,,,,,,,,,,,,
022.jpg,xy10-23,Barbaracle,Pokémon,Water,Fates Collide,23,Rare,https://images.pokemontcg.io/xy10/23_hires.png,https://images.pokemontcg.io/xy10/23.png,100,"[{""name"": ""Hand Block"", ""text"": ""If you have a Stadium card in play, your opponent can't attach any Special Energy cards from his or her hand to his or her Pokémon."", ""type"": ""Ability""}]","[{""name"": ""Claw Slash"", ""cost"": [""Water"", ""Water"", ""Colorless""], ""convertedEnergyCost"": 3, ""damage"": ""70"", ""text"": """"}]",Claw Slash,70,,Grass:×2,,Colorless__Colorless__Colorless,Binacle,Shin Nagasawa,"Barbaracle's legs and hands have minds of their own, and they will move independently. But they usually follow the head's orders.",,,,,,,,,,,,,,,,,,,,,,,,,
023.jpg,xy10-24,Rotom,Pokémon,Lightning,Fates Collide,24,Rare,https://images.pokemontcg.io/xy10/24_hires.png,https://images.pokemontcg.io/xy10/24.png,70,,"[{""name"": ""Energy Extract"", ""cost"": [""Lightning""], ""convertedEnergyCost"": 1, ""damage"": """", ""text"": ""Search your deck for a basic Energy card and attach it to this Pokémon. Shuffle your deck afterward.""}, {""name"": ""Plasmagic"", ""cost"": [""Colorless"", ""Colorless""], ""convertedEnergyCost"": 2, ""damage"": """", ""text"": ""Move 2 damage counters from each of your Pokémon to your opponent's Active Pokémon.""}]",Energy Extract|Plasmagic,|,Search your deck for a basic Energy card and attach it to this Pokémon. Shuffle your deck afterward.|Move 2 damage counters from each of your Pokémon to your opponent's Active Pokémon.,Fighting:×2,Metal:-20,Colorless,,Tomokazu Komiya,Its body is composed of plasma. It is known to infiltrate electronic devices and wreak havoc.,,,,,,,,,,,,,,,,,,,,,,,,,
024.jpg,xy10-25,Alakazam-EX,Pokémon,Psychic,Fates Collide,25,Rare Holo EX,https://images.pokemontcg.io/xy10/25_hires.png,https://images.pokemontcg.io/xy10/25.png,160,"[{""name"": ""Kinesis"", ""text"": ""When you play M Alakazam-EX from your hand to evolve this Pokémon, before it evolves, you may put 2 damage counters on your opponent's Active Pokémon and 3 damage counters on 1 of your opponent's Benched Pokémon."", ""type"": ""Ability""}]","[{""name"": ""Suppression"", ""cost"": [""Psychic"", ""Colorless""], ""convertedEnergyCost"": 2, ""damage"": """", ""text"": ""Put 3 damage counters on each of your opponent's Pokémon that has any Energy attached to it.""}]",Suppression,,Put 3 damage counters on each of your opponent's Pokémon that has any Energy attached to it.,Psychic:×2,,Colorless__Colorless,,PLANETA,,,,,,,,,,,,,,,,,,,,,,,,,,
025.jpg,xy10-26,M Alakazam-EX,Pokémon,Psychic,Fates Collide,26,Rare Holo EX,https://images.pokemontcg.io/xy10/26_hires.png,https://images.pokemontcg.io/xy10/26.png,210,,"[{""name"": ""Zen Force"", ""cost"": [""Psychic"", ""Colorless""], ""convertedEnergyCost"": 2, ""damage"": ""10+"", ""text"": ""This attack does 30 more damage for each damage counter on your opponent's Active Pokémon.""}]",Zen Force,10+,This attack does 30 more damage for each damage counter on your opponent's Active Pokémon.,Psychic:×2,,Colorless,Alakazam-EX,5ban Graphics,,,,,,,,,,,,,,,,,,,,,,,,,,
026.jpg,xy10-27,Koffing,Pokémon,Psychic,Fates Collide,27,Common,https://images.pokemontcg.io/xy10/27_hires.png,https://images.pokemontcg.io/xy10/27.png,60,,"[{""name"": ""Division"", ""cost"": [""Psychic""], ""convertedEnergyCost"": 1, ""damage"": """", ""text"": ""Search your deck for up to 2 Koffing and put them onto your Bench. Shuffle your deck afterward.""}]",Division,,Search your deck for up to 2 Koffing and put them onto your Bench. Shuffle your deck afterward.,Psychic:×2,,Colorless__Colorless,,sui,"Lighter-than-air gases in its body keep it aloft. The gases not only smell, they are also explosive.",,,,,,,,,,,,,,,,,,,,,,,,,
027.jpg,xy10-28,Weezing,Pokémon,Psychic,Fates Collide,28,Uncommon,https://images.pokemontcg.io/xy10/28_hires.png,https://images.pokemontcg.io/xy10/28.png,110,,"[{""name"": ""Balloon Bomb"", ""cost"": [""Colorless"", ""Colorless""], ""convertedEnergyCost"": 2, ""damage"": """", ""text"": ""Flip 2 coins. For each heads, discard 2 cards from the top of your opponent's deck.""}, {""name"": ""Thick Liquid"", ""cost"": [""Psychic"", ""Colorless"", ""Colorless""], ""convertedEnergyCost"": 3, ""damage"": ""80"", ""text"": ""Both Active Pokémon are now Confused and Poisoned.""}]",Balloon Bomb|Thick Liquid,|80,"Flip 2 coins. For each heads, discard 2 cards from the top of your opponent's deck.|Both Active Pokémon are now Confused and Poisoned.",Psychic:×2,,Colorless__Colorless__Colorless,Koffing,Shin Nagasawa,"Very rarely, a sudden mutation can result in two small Koffing twins becoming conjoined as a Weezing.",,,,,,,,,,,,,,,,,,,,,,,,,
028.jpg,xy10-29,Mew,Pokémon,Psychic,Fates Collide,29,Rare Holo,https://images.pokemontcg.io/xy10/29_hires.png,https://images.pokemontcg.io/xy10/29.png,50,"[{""name"": ""Memories of Dawn"", ""text"": ""This Pokémon can use the attacks of any of your Basic Pokémon in play. (You still need the necessary Energy to use each attack.)"", ""type"": ""Ability""}]","[{""name"": ""Encounter"", ""cost"": [""Colorless""], ""convertedEnergyCost"": 1, ""damage"": """", ""text"": ""Search your deck for a Pokémon, reveal it, and put it into your hand. Shuffle your deck afterward.""}]",Encounter,,"Search your deck for a Pokémon, reveal it, and put it into your hand. Shuffle your deck afterward.",Psychic:×2,,,,Mitsuhiro Arita,"Its DNA is said to contain the genetic codes of all Pokémon, so it can use all kinds of techniques.",,,,,,,,,,,,,,,,,,,,,,,,,
029.jpg,xy10-30,Spoink,Pokémon,Psychic,Fates Collide,30,Common,https://images.pokemontcg.io/xy10/30_hires.png,https://images.pokemontcg.io/xy10/30.png,60,,"[{""name"": ""Rocket Jump"", ""cost"": [""Psychic""], ""convertedEnergyCost"": 1, ""damage"": ""30"", ""text"": ""Flip a coin. If tails, this attack does nothing.""}]",Rocket Jump,30,"Flip a coin. If tails, this attack does nothing.",Psychic:×2,,Colorless,,TOKIYA,It bounces around on its tail to keep its heart pumping. It carries a pearl from Clamperl on its head.,,,,,,,,,,,,,,,,,,,,,,,,,
030.jpg,xy10-31,Grumpig,Pokémon,Psychic,Fates Collide,31,Rare,https://images.pokemontcg.io/xy10/31_hires.png,https://images.pokemontcg.io/xy10/31.png,100,,"[{""name"": ""Head Walking"", ""cost"": [""Psychic""], ""convertedEnergyCost"": 1, ""damage"": """", ""text"": ""Put a Basic Pokémon from your opponent's discard pile onto his or her Bench. Then, put 3 damage counters on that Pokémon.""}, {""name"": ""Knock Back"", ""cost"": [""Psychic"", ""Psychic""], ""convertedEnergyCost"": 2, ""damage"": ""50"", ""text"": ""Your opponent switches his or her Active Pokémon with 1 of his or her Benched Pokémon.""}]",Head Walking|Knock Back,|50,"Put a Basic Pokémon from your opponent's discard pile onto his or her Bench. Then, put 3 damage counters on that Pokémon.|Your opponent switches his or her Active Pokémon with 1 of his or her Benched Pokémon.",Psychic:×2,,Colorless__Colorless,Spoink,Sanosuke Sakuma,It uses black pearls to amplify its psychic power. It does an odd dance to gain control over foes.,,,,,,,,,,,,,,,,,,,,,,,,,
031.jpg,xy10-32,Gothita,Pokémon,Psychic,Fates Collide,32,Common,https://images.pokemontcg.io/xy10/32_hires.png,https://images.pokemontcg.io/xy10/32.png,60,,"[{""name"": ""Psybeam"", ""cost"": [""Colorless"", ""Colorless""], ""convertedEnergyCost"": 2, ""damage"": ""20"", ""text"": ""Your opponent's Active Pokémon is now Confused.""}]",Psybeam,20,Your opponent's Active Pokémon is now Confused.,Psychic:×2,,Colorless,,Kagemaru Himeno,"They intently observe both Trainers and Pokémon. Apparently, they are looking at something only Gothita can see.",,,,,,,,,,,,,,,,,,,,,,,,,
032.jpg,xy10-33,Solosis,Pokémon,Psychic,Fates Collide,33,Common,https://images.pokemontcg.io/xy10/33_hires.png,https://images.pokemontcg.io/xy10/33.png,30,,"[{""name"": ""Mini Link"", ""cost"": [""Psychic"", ""Colorless""], ""convertedEnergyCost"": 2, ""damage"": ""10+"", ""text"": ""If Solosis is on your Bench, this attack does 30 more damage.""}]",Mini Link,10+,"If Solosis is on your Bench, this attack does 30 more damage.",Psychic:×2,,Colorless,,match,They drive away attackers by unleashing psychic power. They can use telepathy to talk with others.,,,,,,,,,,,,,,,,,,,,,,,,,
033.jpg,xy10-34,Duosion,Pokémon,Psychic,Fates Collide,34,Uncommon,https://images.pokemontcg.io/xy10/34_hires.png,https://images.pokemontcg.io/xy10/34.png,60,,"[{""name"": ""Double Link"", ""cost"": [""Psychic"", ""Colorless""], ""convertedEnergyCost"": 2, ""damage"": ""10+"", ""text"": ""If Solosis is on your Bench, this attack does 30 more damage. If Duosion is on your Bench, this attack does 60 more damage.""}]",Double Link,10+,"If Solosis is on your Bench, this attack does 30 more damage. If Duosion is on your Bench, this attack does 60 more damage.",Psychic:×2,,Colorless,Solosis,Sumiyoshi Kizuki,"When their two divided brains think the same thoughts, their psychic power is maximized.",,,,,,,,,,,,,,,,,,,,,,,,,
