Image_Names,Card_ID,Card_Name,Super_Type,Types,Set_Name,Number,Rarity,Large_Image_URL,Small_Image_URL,HP,Abilities,Attacks_JSON,Attack_Names,Attack_Damages,Attack_Texts,Weaknesses,Resistances,Retreat_Cost,Evolves_From,Artist,FlavorText,Normal_low,Normal_mid,Normal_high,Normal_market,Normal_directLow,Holofoil_low,Holofoil_mid,Holofoil_high,Holofoil_market,Holofoil_directLow,ReverseHolofoil_low,ReverseHolofoil_mid,ReverseHolofoil_high,ReverseHolofoil_market,ReverseHolofoil_directLow,FirstEditionHolofoil_low,FirstEditionHolofoil_mid,FirstEditionHolofoil_high,FirstEditionHolofoil_market,FirstEditionHolofoil_directLow,FirstEditionNormal_low,FirstEditionNormal_mid,FirstEditionNormal_high,FirstEditionNormal_market,FirstEditionNormal_directLow
094.jpg,ex5-95,Metagross ex,Pokémon,Metal,Hidden Legends,95,Rare Holo EX,https://images.pokemontcg.io/ex5/95_hires.png,https://images.pokemontcg.io/ex5/95.png,150,,"[{""name"": ""Metal Reversal"", ""cost"": [""Metal"", ""Colorless""], ""convertedEnergyCost"": 2, ""damage"": ""40"", ""text"": ""Before doing damage, you may choose 1 of your opponent's Benched Pokémon and switch it with 1 of the Defending Pokémon. Your opponent chooses the Defending Pokémon to switch. If you do, this attack does 40 damage to the new Defending Pokémon.""}, {""name"": ""Extra Comet Punch"", ""cost"": [""Metal"", ""Metal"", ""Colorless"", ""Colorless""], ""convertedEnergyCost"": 4, ""damage"": ""50+"", ""text"": ""During your next turn, Extra Comet Punch does 50 damage plus 50 more damage.""}]",Metal Reversal|Extra Comet Punch,40|50+,"Before doing damage, you may choose 1 of your opponent's Benched Pokémon and switch it with 1 of the Defending Pokémon. Your opponent chooses the Defending Pokémon to switch. If you do, this attack does 40 damage to the new Defending Pokémon.|During your next turn, Extra Comet Punch does 50 damage plus 50 more damage.",Fighting:×2|Fire:×2,Grass:-30,Colorless__Colorless__Colorless__Colorless,Metang,Mitsuhiro Arita,,,,,,,,,,,,,,,,,,,,,,,,,,
095.jpg,ex5-96,Ninetales ex,Pokémon,Fire,Hidden Legends,96,Rare Holo EX,https://images.pokemontcg.io/ex5/96_hires.png,https://images.pokemontcg.io/ex5/96.png,90,,"[{""name"": ""Intense Glare"", ""cost"": [""Colorless""], ""convertedEnergyCost"": 1, ""damage"": """", ""text"": ""Switch 1 of your opponent's Benched Pokémon with 1 of the Defending Pokémon. Your opponent chooses the Defending Pokémon to switch. The new Defending Pokémon is now Burned and Confused.""}, {""name"": ""Fire Blast"", ""cost"": [""Fire"", ""Colorless"", ""Colorless"", ""Colorless""], ""convertedEnergyCost"": 4, ""damage"": ""100"", ""text"": ""Discard a Fire Energy attached to Ninetales ex.""}]",Intense Glare|Fire Blast,|100,Switch 1 of your opponent's Benched Pokémon with 1 of the Defending Pokémon. Your opponent chooses the Defending Pokémon to switch. The new Defending Pokémon is now Burned and Confused.|Discard a Fire Energy attached to Ninetales ex.,Water:×2,,Colorless,Vulpix,Ryo Ueda,,,,,,,,,,,,,,,,,,,,,,,,,,
096.jpg,ex5-97,Regice ex,Pokémon,Water,Hidden Legends,97,Rare Holo EX,https://images.pokemontcg.io/ex5/97_hires.png,https://images.pokemontcg.io/ex5/97.png,90,"[{""name"": ""Crystal Body"", ""text"": ""Prevent all effects of attacks, except damage, done to Regice ex by the Attacking Pokémon."", ""type"": ""Poké-Body""}]","[{""name"": ""Freeze Lock"", ""cost"": [""Water"", ""Water"", ""Colorless""], ""convertedEnergyCost"": 3, ""damage"": ""60"", ""text"": ""Flip a coin. If heads, your opponent can't attach Energy cards from his or her hand to the Defending Pokémon during his or her next turn.""}]",Freeze Lock,60,"Flip a coin. If heads, your opponent can't attach Energy cards from his or her hand to the Defending Pokémon during his or her next turn.",Metal:×2,,Colorless__Colorless,,Mitsuhiro Arita,,,,,,,,,,,,,,,,,,,,,,,,,,
097.jpg,ex5-98,Regirock ex,Pokémon,Fighting,Hidden Legends,98,Rare Holo EX,https://images.pokemontcg.io/ex5/98_hires.png,https://images.pokemontcg.io/ex5/98.png,100,"[{""name"": ""Healing Stone"", ""text"": ""At any time between turns, remove 1 damage counter from Regirock ex."", ""type"": ""Poké-Body""}]","[{""name"": ""Tonnage"", ""cost"": [""Fighting"", ""Fighting"", ""Colorless""], ""convertedEnergyCost"": 3, ""damage"": ""60+"", ""text"": ""You may do 60 damage plus 20 more damage. If you do, Regirock ex does 30 damage to itself.""}]",Tonnage,60+,"You may do 60 damage plus 20 more damage. If you do, Regirock ex does 30 damage to itself.",Water:×2,,Colorless__Colorless__Colorless,,Mitsuhiro Arita,,,,,,,,,,,,,,,,,,,,,,,,,,
098.jpg,ex5-99,Registeel ex,Pokémon,Metal,Hidden Legends,99,Rare Holo EX,https://images.pokemontcg.io/ex5/99_hires.png,https://images.pokemontcg.io/ex5/99.png,90,"[{""name"": ""Exoskeleton"", ""text"": ""Any damage done to Registeel ex by attacks is reduced by 10 (after applying Weakness and Resistance)."", ""type"": ""Poké-Body""}]","[{""name"": ""Steel Wave"", ""cost"": [""Metal"", ""Metal"", ""Colorless""], ""convertedEnergyCost"": 3, ""damage"": ""50"", ""text"": ""Does 20 damage to each of your opponent's Benched Pokémon of the same type as the Defending Pokémon. (Don't apply Weakness and Resistance for Benched Pokémon.)""}]",Steel Wave,50,Does 20 damage to each of your opponent's Benched Pokémon of the same type as the Defending Pokémon. (Don't apply Weakness and Resistance for Benched Pokémon.),Fire:×2,Grass:-30,Colorless__Colorless,,Mitsuhiro Arita,,,,,,,,,,,,,,,,,,,,,,,,,,
099.jpg,ex5-100,Vileplume ex,Pokémon,Grass,Hidden Legends,100,Rare Holo EX,https://images.pokemontcg.io/ex5/100_hires.png,https://images.pokemontcg.io/ex5/100.png,140,"[{""name"": ""Block Dust"", ""text"": ""As long as Vileplume ex is your Active Pokémon, your opponent can't play any Trainer cards (except for Supporter cards) from his or her hand."", ""type"": ""Poké-Body""}]","[{""name"": ""Special Formula"", ""cost"": [""Grass"", ""Colorless"", ""Colorless""], ""convertedEnergyCost"": 3, ""damage"": ""50"", ""text"": ""Flip a coin. If heads, the Defending Pokémon is now Asleep and Poisoned. If tails, the Defending Pokémon is now Confused.""}]",Special Formula,50,"Flip a coin. If heads, the Defending Pokémon is now Asleep and Poisoned. If tails, the Defending Pokémon is now Confused.",Psychic:×2,,Colorless__Colorless,Gloom,Ryo Ueda,,,,,,,,,,,,,,,,,,,,,,,,,,
100.jpg,ex5-101,Wigglytuff ex,Pokémon,Colorless,Hidden Legends,101,Rare Holo EX,https://images.pokemontcg.io/ex5/101_hires.png,https://images.pokemontcg.io/ex5/101.png,100,,"[{""name"": ""Sleepy Song"", ""cost"": [""Colorless"", ""Colorless""], ""convertedEnergyCost"": 2, ""damage"": ""30"", ""text"": ""Each Defending Pokémon is now Asleep.""}, {""name"": ""Do the Wave"", ""cost"": [""Colorless"", ""Colorless"", ""Colorless""], ""convertedEnergyCost"": 3, ""damage"": ""30+"", ""text"": ""Does 30 damage plus 10 more damage for each of your Benched Pokémon.""}]",Sleepy Song|Do the Wave,30|30+,Each Defending Pokémon is now Asleep.|Does 30 damage plus 10 more damage for each of your Benched Pokémon.,Fighting:×2,,Colorless,Jigglypuff,Ryo Ueda,,,,,,,,,,,,,,,,,,,,,,,,,,
101.jpg,ex5-102,Groudon,Pokémon,Fighting,Hidden Legends,102,Rare Secret,https://images.pokemontcg.io/ex5/102_hires.png,https://images.pokemontcg.io/ex5/102.png,80,,"[{""name"": ""Mud Shot"", ""cost"": [""Fighting"", ""Colorless""], ""convertedEnergyCost"": 2, ""damage"": ""20"", ""text"": """"}, {""name"": ""Earthquake"", ""cost"": [""Fighting"", ""Fighting"", ""Fighting"", ""Colorless""], ""convertedEnergyCost"": 4, ""damage"": ""60"", ""text"": ""Does 10 damage to each of your Benched Pokémon. (Don't apply Weakness and Resistance for Benched Pokémon.)""}]",Mud Shot|Earthquake,20|60,|Does 10 damage to each of your Benched Pokémon. (Don't apply Weakness and Resistance for Benched Pokémon.),Grass:×2,,Colorless__Colorless__Colorless,,Mitsuhiro Arita,,,,,,,,,,,,,,,,,,,,,,,,,,
