Image_Names,Card_ID,Card_Name,Super_Type,Types,Set_Name,Number,Rarity,Large_Image_URL,Small_Image_URL,HP,Abilities,Attacks_JSON,Attack_Names,Attack_Damages,Attack_Texts,Weaknesses,Resistances,Retreat_Cost,Evolves_From,Artist,FlavorText,Normal_low,Normal_mid,Normal_high,Normal_market,Normal_directLow,Holofoil_low,Holofoil_mid,Holofoil_high,Holofoil_market,Holofoil_directLow,ReverseHolofoil_low,ReverseHolofoil_mid,ReverseHolofoil_high,ReverseHolofoil_market,ReverseHolofoil_directLow,FirstEditionHolofoil_low,FirstEditionHolofoil_mid,FirstEditionHolofoil_high,FirstEditionHolofoil_market,FirstEditionHolofoil_directLow,FirstEditionNormal_low,FirstEditionNormal_mid,FirstEditionNormal_high,FirstEditionNormal_market,FirstEditionNormal_directLow
055.jpg,ex5-56,Chinchou,Pokémon,Lightning,Hidden Legends,56,Common,https://images.pokemontcg.io/ex5/56_hires.png,https://images.pokemontcg.io/ex5/56.png,50,,"[{""name"": ""Pound"", ""cost"": [""Colorless""], ""convertedEnergyCost"": 1, ""damage"": ""10"", ""text"": """"}, {""name"": ""Spark"", ""cost"": [""Lightning"", ""Colorless""], ""convertedEnergyCost"": 2, ""damage"": ""10"", ""text"": ""Choose 2 of your opponent's Benched Pokémon. This attack does 10 damage to each of those Pokémon. (Don't apply Weakness and Resistance for Benched Pokémon.)""}]",Pound|Spark,10|10,|Choose 2 of your opponent's Benched Pokémon. This attack does 10 damage to each of those Pokémon. (Don't apply Weakness and Resistance for Benched Pokémon.),Fighting:×2,,Colorless,,Aya Kusube,,,,,,,,,,,,,,,,,,,,,,,,,,
056.jpg,ex5-57,Chinchou,Pokémon,Lightning,Hidden Legends,57,Common,https://images.pokemontcg.io/ex5/57_hires.png,https://images.pokemontcg.io/ex5/57.png,50,,"[{""name"": ""Random Spark"", ""cost"": [""Lightning""], ""convertedEnergyCost"": 1, ""damage"": """", ""text"": ""Choose 1 of your opponent's Pokémon. This attack does 10 damage to that Pokémon. (Don't apply Weakness and Resistance for Benched Pokémon.)""}, {""name"": ""Lightning Ball"", ""cost"": [""Lightning"", ""Colorless""], ""convertedEnergyCost"": 2, ""damage"": ""20"", ""text"": """"}]",Random Spark|Lightning Ball,|20,Choose 1 of your opponent's Pokémon. This attack does 10 damage to that Pokémon. (Don't apply Weakness and Resistance for Benched Pokémon.)|,Fighting:×2,,Colorless,,Nakaoka,,,,,,,,,,,,,,,,,,,,,,,,,,
057.jpg,ex5-58,Clamperl,Pokémon,Water,Hidden Legends,58,Common,https://images.pokemontcg.io/ex5/58_hires.png,https://images.pokemontcg.io/ex5/58.png,40,"[{""name"": ""Exoskeleton"", ""text"": ""Any damage done to Clamperl by attacks is reduced by 10 (after applying Weakness and Resistance)."", ""type"": ""Poké-Body""}]","[{""name"": ""Bubble"", ""cost"": [""Water"", ""Colorless""], ""convertedEnergyCost"": 2, ""damage"": ""20"", ""text"": ""Flip a coin. If heads, the Defending Pokémon is now Paralyzed.""}]",Bubble,20,"Flip a coin. If heads, the Defending Pokémon is now Paralyzed.",Lightning:×2,,Colorless,,Kagemaru Himeno,,,,,,,,,,,,,,,,,,,,,,,,,,
058.jpg,ex5-59,Cyndaquil,Pokémon,Fire,Hidden Legends,59,Common,https://images.pokemontcg.io/ex5/59_hires.png,https://images.pokemontcg.io/ex5/59.png,50,,"[{""name"": ""Swift"", ""cost"": [""Colorless""], ""convertedEnergyCost"": 1, ""damage"": ""10"", ""text"": ""This attack's damage isn't affected by Weakness, Resistance, Poké-Powers, Poké-Bodies, or any other effects on the Defending Pokémon.""}, {""name"": ""Rage"", ""cost"": [""Colorless"", ""Colorless""], ""convertedEnergyCost"": 2, ""damage"": ""10+"", ""text"": ""Does 10 damage plus 10 more damage for each damage counter on Cyndaquil.""}]",Swift|Rage,10|10+,"This attack's damage isn't affected by Weakness, Resistance, Poké-Powers, Poké-Bodies, or any other effects on the Defending Pokémon.|Does 10 damage plus 10 more damage for each damage counter on Cyndaquil.",Water:×2,,Colorless,,Ken Ikuji,,,,,,,,,,,,,,,,,,,,,,,,,,
059.jpg,ex5-60,Doduo,Pokémon,Colorless,Hidden Legends,60,Common,https://images.pokemontcg.io/ex5/60_hires.png,https://images.pokemontcg.io/ex5/60.png,40,,"[{""name"": ""Drill Peck"", ""cost"": [""Colorless""], ""convertedEnergyCost"": 1, ""damage"": ""10"", ""text"": """"}]",Drill Peck,10,,Lightning:×2,Fighting:-30,Colorless,,Miki Tanaka,,,,,,,,,,,,,,,,,,,,,,,,,,
060.jpg,ex5-61,Feebas,Pokémon,Water,Hidden Legends,61,Common,https://images.pokemontcg.io/ex5/61_hires.png,https://images.pokemontcg.io/ex5/61.png,30,,"[{""name"": ""Tackle"", ""cost"": [""Colorless""], ""convertedEnergyCost"": 1, ""damage"": ""10"", ""text"": """"}, {""name"": ""Ascension"", ""cost"": [""Water""], ""convertedEnergyCost"": 1, ""damage"": """", ""text"": ""Search your deck for a card that evolves from Feebas and put it on Feebas. (This counts as evolving Feebas.) Shuffle your deck afterward.""}]",Tackle|Ascension,10|,|Search your deck for a card that evolves from Feebas and put it on Feebas. (This counts as evolving Feebas.) Shuffle your deck afterward.,Lightning:×2,,Colorless,,Tomokazu Komiya,,,,,,,,,,,,,,,,,,,,,,,,,,
061.jpg,ex5-62,Gulpin,Pokémon,Grass,Hidden Legends,62,Common,https://images.pokemontcg.io/ex5/62_hires.png,https://images.pokemontcg.io/ex5/62.png,50,,"[{""name"": ""Yawn"", ""cost"": [""Colorless""], ""convertedEnergyCost"": 1, ""damage"": """", ""text"": ""The Defending Pokémon is now Asleep.""}, {""name"": ""Spit Poison"", ""cost"": [""Grass""], ""convertedEnergyCost"": 1, ""damage"": """", ""text"": ""The Defending Pokémon is now Poisoned.""}]",Yawn|Spit Poison,|,The Defending Pokémon is now Asleep.|The Defending Pokémon is now Poisoned.,Psychic:×2,,Colorless,,Yuka Morii,,,,,,,,,,,,,,,,,,,,,,,,,,
062.jpg,ex5-63,Jigglypuff,Pokémon,Colorless,Hidden Legends,63,Common,https://images.pokemontcg.io/ex5/63_hires.png,https://images.pokemontcg.io/ex5/63.png,50,,"[{""name"": ""Rollout"", ""cost"": [""Colorless""], ""convertedEnergyCost"": 1, ""damage"": ""10"", ""text"": """"}, {""name"": ""Sleepy Song"", ""cost"": [""Colorless"", ""Colorless""], ""convertedEnergyCost"": 2, ""damage"": """", ""text"": ""Each Defending Pokémon is now Asleep.""}]",Rollout|Sleepy Song,10|,|Each Defending Pokémon is now Asleep.,Fighting:×2,,Colorless,,Naoyo Kimura,,,,,,,,,,,,,,,,,,,,,,,,,,
063.jpg,ex5-64,Machop,Pokémon,Fighting,Hidden Legends,64,Common,https://images.pokemontcg.io/ex5/64_hires.png,https://images.pokemontcg.io/ex5/64.png,50,,"[{""name"": ""Knuckle Punch"", ""cost"": [""Colorless""], ""convertedEnergyCost"": 1, ""damage"": ""10"", ""text"": """"}, {""name"": ""Karate Chop"", ""cost"": [""Fighting"", ""Colorless""], ""convertedEnergyCost"": 2, ""damage"": ""30-"", ""text"": ""Does 30 damage minus 10 damage for each damage counter on Machop.""}]",Knuckle Punch|Karate Chop,10|30-,|Does 30 damage minus 10 damage for each damage counter on Machop.,Psychic:×2,,Colorless,,Hajime Kusajima,,,,,,,,,,,,,,,,,,,,,,,,,,
064.jpg,ex5-65,Meditite,Pokémon,Psychic,Hidden Legends,65,Common,https://images.pokemontcg.io/ex5/65_hires.png,https://images.pokemontcg.io/ex5/65.png,50,,"[{""name"": ""Double Chop"", ""cost"": [""Colorless""], ""convertedEnergyCost"": 1, ""damage"": ""10×"", ""text"": ""Flip 2 coins. This attack does 10 damage times the number of heads.""}, {""name"": ""Calm Mind"", ""cost"": [""Psychic""], ""convertedEnergyCost"": 1, ""damage"": """", ""text"": ""Remove 2 damage counters from Meditite (remove 1 if there is only 1).""}]",Double Chop|Calm Mind,10×|,Flip 2 coins. This attack does 10 damage times the number of heads.|Remove 2 damage counters from Meditite (remove 1 if there is only 1).,Psychic:×2,,Colorless,,Ken Sugimori,,,,,,,,,,,,,,,,,,,,,,,,,,
065.jpg,ex5-66,Meditite,Pokémon,Fighting,Hidden Legends,66,Common,https://images.pokemontcg.io/ex5/66_hires.png,https://images.pokemontcg.io/ex5/66.png,50,,"[{""name"": ""Jab"", ""cost"": [""Fighting""], ""convertedEnergyCost"": 1, ""damage"": ""10"", ""text"": """"}, {""name"": ""Steady Punch"", ""cost"": [""Colorless"", ""Colorless""], ""convertedEnergyCost"": 2, ""damage"": ""20+"", ""text"": ""Flip a coin. If heads, this attack does 20 damage plus 10 more damage.""}]",Jab|Steady Punch,10|20+,"|Flip a coin. If heads, this attack does 20 damage plus 10 more damage.",Psychic:×2,,Colorless,,Atsuko Nishida,,,,,,,,,,,,,,,,,,,,,,,,,,
066.jpg,ex5-67,Minun,Pokémon,Lightning,Hidden Legends,67,Common,https://images.pokemontcg.io/ex5/67_hires.png,https://images.pokemontcg.io/ex5/67.png,50,,"[{""name"": ""Minus Energy"", ""cost"": [""Colorless""], ""convertedEnergyCost"": 1, ""damage"": ""10"", ""text"": ""Flip a coin. If heads, choose 1 Energy attached to the Defending Pokémon. Your opponent returns that card to his or her hand.""}, {""name"": ""Thundershock"", ""cost"": [""Lightning"", ""Colorless""], ""convertedEnergyCost"": 2, ""damage"": ""20"", ""text"": ""Flip a coin. If heads, the Defending Pokémon is now Paralyzed.""}]",Minus Energy|Thundershock,10|20,"Flip a coin. If heads, choose 1 Energy attached to the Defending Pokémon. Your opponent returns that card to his or her hand.|Flip a coin. If heads, the Defending Pokémon is now Paralyzed.",Fighting:×2,Metal:-30,Colorless,,Kagemaru Himeno,,,,,,,,,,,,,,,,,,,,,,,,,,
067.jpg,ex5-68,Oddish,Pokémon,Grass,Hidden Legends,68,Common,https://images.pokemontcg.io/ex5/68_hires.png,https://images.pokemontcg.io/ex5/68.png,50,,"[{""name"": ""Poisonpowder"", ""cost"": [""Colorless""], ""convertedEnergyCost"": 1, ""damage"": """", ""text"": ""Flip a coin. If heads, the Defending Pokémon is now Poisoned.""}, {""name"": ""Razor Leaf"", ""cost"": [""Grass""], ""convertedEnergyCost"": 1, ""damage"": ""10"", ""text"": """"}]",Poisonpowder|Razor Leaf,|10,"Flip a coin. If heads, the Defending Pokémon is now Poisoned.|",Fire:×2,,Colorless,,Yuka Morii,,,,,,,,,,,,,,,,,,,,,,,,,,
068.jpg,ex5-69,Plusle,Pokémon,Lightning,Hidden Legends,69,Common,https://images.pokemontcg.io/ex5/69_hires.png,https://images.pokemontcg.io/ex5/69.png,50,,"[{""name"": ""Plus Energy"", ""cost"": [""Colorless""], ""convertedEnergyCost"": 1, ""damage"": """", ""text"": ""Flip a coin. If heads, attach a Lightning Energy card from your hand to any of your Pokémon.""}, {""name"": ""Dazzle Blast"", ""cost"": [""Lightning"", ""Colorless""], ""convertedEnergyCost"": 2, ""damage"": ""20"", ""text"": ""Flip a coin. If heads, the Defending Pokémon is now Confused.""}]",Plus Energy|Dazzle Blast,|20,"Flip a coin. If heads, attach a Lightning Energy card from your hand to any of your Pokémon.|Flip a coin. If heads, the Defending Pokémon is now Confused.",Fighting:×2,Metal:-30,Colorless,,Kagemaru Himeno,,,,,,,,,,,,,,,,,,,,,,,,,,
069.jpg,ex5-70,Rhyhorn,Pokémon,Fighting,Hidden Legends,70,Common,https://images.pokemontcg.io/ex5/70_hires.png,https://images.pokemontcg.io/ex5/70.png,60,,"[{""name"": ""Double Stab"", ""cost"": [""Colorless""], ""convertedEnergyCost"": 1, ""damage"": ""10×"", ""text"": ""Flip 2 coins. This attack does 10 damage times the number of heads.""}, {""name"": ""Take Down"", ""cost"": [""Fighting"", ""Colorless"", ""Colorless""], ""convertedEnergyCost"": 3, ""damage"": ""50"", ""text"": ""Rhyhorn does 10 damage to itself.""}]",Double Stab|Take Down,10×|50,Flip 2 coins. This attack does 10 damage times the number of heads.|Rhyhorn does 10 damage to itself.,Water:×2,,Colorless,,Atsuko Nishida,,,,,,,,,,,,,,,,,,,,,,,,,,
070.jpg,ex5-71,Seedot,Pokémon,Grass,Hidden Legends,71,Common,https://images.pokemontcg.io/ex5/71_hires.png,https://images.pokemontcg.io/ex5/71.png,40,,"[{""name"": ""Growth Spurt"", ""cost"": [""Colorless""], ""convertedEnergyCost"": 1, ""damage"": """", ""text"": ""Attach a Grass Energy card from your hand to Seedot.""}, {""name"": ""Trip Over"", ""cost"": [""Colorless"", ""Colorless""], ""convertedEnergyCost"": 2, ""damage"": ""10+"", ""text"": ""Flip a coin. If heads, this attack does 10 damage plus 10 more damage.""}]",Growth Spurt|Trip Over,|10+,"Attach a Grass Energy card from your hand to Seedot.|Flip a coin. If heads, this attack does 10 damage plus 10 more damage.",Fire:×2,,Colorless,,Hisao Nakamura,,,,,,,,,,,,,,,,,,,,,,,,,,
071.jpg,ex5-72,Shuppet,Pokémon,Psychic,Hidden Legends,72,Common,https://images.pokemontcg.io/ex5/72_hires.png,https://images.pokemontcg.io/ex5/72.png,40,,"[{""name"": ""Shadow Crush"", ""cost"": [""Psychic""], ""convertedEnergyCost"": 1, ""damage"": ""10"", ""text"": ""You may discard 1 Psychic Energy card attached to Shuppet. If you do, your opponent discards 1 Energy card attached to the Defending Pokémon.""}]",Shadow Crush,10,"You may discard 1 Psychic Energy card attached to Shuppet. If you do, your opponent discards 1 Energy card attached to the Defending Pokémon.",Darkness:×2,Fighting:-30,Colorless,,Midori Harada,,,,,,,,,,,,,,,,,,,,,,,,,,
072.jpg,ex5-73,Snorunt,Pokémon,Water,Hidden Legends,73,Common,https://images.pokemontcg.io/ex5/73_hires.png,https://images.pokemontcg.io/ex5/73.png,50,,"[{""name"": ""Ice Breath"", ""cost"": [""Colorless""], ""convertedEnergyCost"": 1, ""damage"": """", ""text"": ""Flip a coin. If heads, the Defending Pokémon is now Paralyzed.""}, {""name"": ""Tackle"", ""cost"": [""Colorless"", ""Colorless""], ""convertedEnergyCost"": 2, ""damage"": ""20"", ""text"": """"}]",Ice Breath|Tackle,|20,"Flip a coin. If heads, the Defending Pokémon is now Paralyzed.|",Metal:×2,,Colorless,,Midori Harada,,,,,,,,,,,,,,,,,,,,,,,,,,
073.jpg,ex5-74,Spheal,Pokémon,Water,Hidden Legends,74,Common,https://images.pokemontcg.io/ex5/74_hires.png,https://images.pokemontcg.io/ex5/74.png,40,,"[{""name"": ""Freezing Breath"", ""cost"": [""Colorless""], ""convertedEnergyCost"": 1, ""damage"": """", ""text"": ""Flip a coin. If heads, the Defending Pokémon is now Paralyzed. If tails, the Defending Pokémon is now Asleep.""}]",Freezing Breath,,"Flip a coin. If heads, the Defending Pokémon is now Paralyzed. If tails, the Defending Pokémon is now Asleep.",Metal:×2,,Colorless,,Atsuko Nishida,,,,,,,,,,,,,,,,,,,,,,,,,,
074.jpg,ex5-75,Staryu,Pokémon,Water,Hidden Legends,75,Common,https://images.pokemontcg.io/ex5/75_hires.png,https://images.pokemontcg.io/ex5/75.png,50,"[{""name"": ""Core Guard"", ""text"": ""If Staryu has any Psychic Energy attached to it, damage done to Staryu by any attack is reduced by 10 (after applying Weakness and Resistance)."", ""type"": ""Poké-Body""}]","[{""name"": ""Pound"", ""cost"": [""Water""], ""convertedEnergyCost"": 1, ""damage"": ""10"", ""text"": """"}]",Pound,10,,Lightning:×2,,Colorless,,Aya Kusube,,,,,,,,,,,,,,,,,,,,,,,,,,
075.jpg,ex5-76,Surskit,Pokémon,Grass,Hidden Legends,76,Common,https://images.pokemontcg.io/ex5/76_hires.png,https://images.pokemontcg.io/ex5/76.png,50,,"[{""name"": ""Splash About"", ""cost"": [""Colorless""], ""convertedEnergyCost"": 1, ""damage"": ""10+"", ""text"": ""If Surskit has less Energy attached to it than the Defending Pokémon, this attack does 10 damage plus 10 more damage.""}]",Splash About,10+,"If Surskit has less Energy attached to it than the Defending Pokémon, this attack does 10 damage plus 10 more damage.",Fire:×2,,Colorless,,Toshinao Aoki,,,,,,,,,,,,,,,,,,,,,,,,,,
076.jpg,ex5-77,Tentacool,Pokémon,Water,Hidden Legends,77,Common,https://images.pokemontcg.io/ex5/77_hires.png,https://images.pokemontcg.io/ex5/77.png,50,"[{""name"": ""Freefloating"", ""text"": ""If Tentacool has no Energy attached to it, Tentacool's Retreat Cost is 0."", ""type"": ""Poké-Body""}]","[{""name"": ""Wrap"", ""cost"": [""Colorless""], ""convertedEnergyCost"": 1, ""damage"": """", ""text"": ""Flip a coin. If heads, the Defending Pokémon is now Paralyzed.""}]",Wrap,,"Flip a coin. If heads, the Defending Pokémon is now Paralyzed.",Lightning:×2,,Colorless,,Hisao Nakamura,,,,,,,,,,,,,,,,,,,,,,,,,,
077.jpg,ex5-78,Togepi,Pokémon,Colorless,Hidden Legends,78,Common,https://images.pokemontcg.io/ex5/78_hires.png,https://images.pokemontcg.io/ex5/78.png,50,,"[{""name"": ""Sleepy Song"", ""cost"": [""Colorless""], ""convertedEnergyCost"": 1, ""damage"": """", ""text"": ""Each Defending Pokémon is now Asleep.""}]",Sleepy Song,,Each Defending Pokémon is now Asleep.,Fighting:×2,,Colorless,,Nakaoka,,,,,,,,,,,,,,,,,,,,,,,,,,
078.jpg,ex5-79,Totodile,Pokémon,Water,Hidden Legends,79,Common,https://images.pokemontcg.io/ex5/79_hires.png,https://images.pokemontcg.io/ex5/79.png,50,,"[{""name"": ""Flail"", ""cost"": [""Colorless""], ""convertedEnergyCost"": 1, ""damage"": ""10×"", ""text"": ""Does 10 damage for each damage counter on Totodile.""}, {""name"": ""Bite"", ""cost"": [""Water"", ""Colorless""], ""convertedEnergyCost"": 2, ""damage"": ""20"", ""text"": """"}]",Flail|Bite,10×|20,Does 10 damage for each damage counter on Totodile.|,Lightning:×2,,Colorless,,Shin-ichi Yoshikawa,,,,,,,,,,,,,,,,,,,,,,,,,,
079.jpg,ex5-80,Voltorb,Pokémon,Lightning,Hidden Legends,80,Common,https://images.pokemontcg.io/ex5/80_hires.png,https://images.pokemontcg.io/ex5/80.png,40,,"[{""name"": ""Recharge"", ""cost"": [""Colorless""], ""convertedEnergyCost"": 1, ""damage"": """", ""text"": ""Search your deck for a Lightning Energy card and attach it to Voltorb. Shuffle your deck afterward.""}, {""name"": ""Rolling Attack"", ""cost"": [""Lightning"", ""Colorless""], ""convertedEnergyCost"": 2, ""damage"": ""20"", ""text"": """"}]",Recharge|Rolling Attack,|20,Search your deck for a Lightning Energy card and attach it to Voltorb. Shuffle your deck afterward.|,Fighting:×2,,Colorless,,Kyoko Umemoto,,,,,,,,,,,,,,,,,,,,,,,,,,
080.jpg,ex5-81,Vulpix,Pokémon,Fire,Hidden Legends,81,Common,https://images.pokemontcg.io/ex5/81_hires.png,https://images.pokemontcg.io/ex5/81.png,50,,"[{""name"": ""Scratch"", ""cost"": [""Colorless""], ""convertedEnergyCost"": 1, ""damage"": ""10"", ""text"": """"}, {""name"": ""Ascension"", ""cost"": [""Fire""], ""convertedEnergyCost"": 1, ""damage"": """", ""text"": ""Search your deck for a card that evolves from Vulpix and put it on Vulpix. (This counts as evolving Vulpix.) Shuffle your deck afterward.""}]",Scratch|Ascension,10|,|Search your deck for a card that evolves from Vulpix and put it on Vulpix. (This counts as evolving Vulpix.) Shuffle your deck afterward.,Water:×2,,Colorless,,Toshinao Aoki,,,,,,,,,,,,,,,,,,,,,,,,,,
081.jpg,ex5-82,Whismur,Pokémon,Colorless,Hidden Legends,82,Common,https://images.pokemontcg.io/ex5/82_hires.png,https://images.pokemontcg.io/ex5/82.png,50,,"[{""name"": ""Wail"", ""cost"": [""Colorless""], ""convertedEnergyCost"": 1, ""damage"": ""10"", ""text"": ""Your opponent switches the Defending Pokémon with 1 of his or her Benched Pokémon.""}]",Wail,10,Your opponent switches the Defending Pokémon with 1 of his or her Benched Pokémon.,Fighting:×2,,Colorless,,Tomokazu Komiya,,,,,,,,,,,,,,,,,,,,,,,,,,
082.jpg,ex5-83,Zubat,Pokémon,Grass,Hidden Legends,83,Common,https://images.pokemontcg.io/ex5/83_hires.png,https://images.pokemontcg.io/ex5/83.png,50,,"[{""name"": ""Quick Turn"", ""cost"": [""Colorless""], ""convertedEnergyCost"": 1, ""damage"": ""10×"", ""text"": ""Flip 2 coins. This attack does 10 damage times the number of heads.""}, {""name"": ""Surprise"", ""cost"": [""Grass""], ""convertedEnergyCost"": 1, ""damage"": """", ""text"": ""Choose 1 card from your opponent's hand without looking. Look at the card you chose, then have your opponent shuffle that card into his or her deck.""}]",Quick Turn|Surprise,10×|,"Flip 2 coins. This attack does 10 damage times the number of heads.|Choose 1 card from your opponent's hand without looking. Look at the card you chose, then have your opponent shuffle that card into his or her deck.",Psychic:×2,,Colorless,,Midori Harada,,,,,,,,,,,,,,,,,,,,,,,,,,
083.jpg,ex5-84,Ancient Technical Machine [Ice],Trainer,,Hidden Legends,84,Uncommon,https://images.pokemontcg.io/ex5/84_hires.png,https://images.pokemontcg.io/ex5/84.png,,,"[{""name"": ""Ice Generator"", ""cost"": [""Colorless""], ""convertedEnergyCost"": 1, ""damage"": """", ""text"": ""Discard all of your opponent's Trainer cards in play. If you do, prevent all effects, including damage, done to the Pokémon using this attack during your opponent's next turn.""}]",Ice Generator,,"Discard all of your opponent's Trainer cards in play. If you do, prevent all effects, including damage, done to the Pokémon using this attack during your opponent's next turn.",,,,,Mitsuhiro Arita,,,,,,,,,,,,,,,,,,,,,,,,,,
084.jpg,ex5-85,Ancient Technical Machine [Rock],Trainer,,Hidden Legends,85,Uncommon,https://images.pokemontcg.io/ex5/85_hires.png,https://images.pokemontcg.io/ex5/85.png,,,"[{""name"": ""Stone Generator"", ""cost"": [""Colorless""], ""convertedEnergyCost"": 1, ""damage"": """", ""text"": ""If your opponent has any Evolved Pokémon in play, remove the highest Stage Evolution card from each of them and put those cards back into his or her hand.""}]",Stone Generator,,"If your opponent has any Evolved Pokémon in play, remove the highest Stage Evolution card from each of them and put those cards back into his or her hand.",,,,,Mitsuhiro Arita,,,,,,,,,,,,,,,,,,,,,,,,,,
085.jpg,ex5-86,Ancient Technical Machine [Steel],Trainer,,Hidden Legends,86,Uncommon,https://images.pokemontcg.io/ex5/86_hires.png,https://images.pokemontcg.io/ex5/86.png,,,"[{""name"": ""Steel Generator"", ""cost"": [""Colorless"", ""Colorless""], ""convertedEnergyCost"": 2, ""damage"": """", ""text"": ""If the Defending Pokémon has a Poké-Power or Poké-Body, choose up to 2 basic Energy cards attached to 1 of your opponent's Pokémon and attach them to the Defending Pokémon.""}]",Steel Generator,,"If the Defending Pokémon has a Poké-Power or Poké-Body, choose up to 2 basic Energy cards attached to 1 of your opponent's Pokémon and attach them to the Defending Pokémon.",,,,,Mitsuhiro Arita,,,,,,,,,,,,,,,,,,,,,,,,,,
086.jpg,ex5-87,Ancient Tomb,Trainer,,Hidden Legends,87,Uncommon,https://images.pokemontcg.io/ex5/87_hires.png,https://images.pokemontcg.io/ex5/87.png,,,,,,,,,,,Ken Ikuji,,,,,,,,,,,,,,,,,,,,,,,,,,
087.jpg,ex5-88,Desert Ruins,Trainer,,Hidden Legends,88,Uncommon,https://images.pokemontcg.io/ex5/88_hires.png,https://images.pokemontcg.io/ex5/88.png,,,,,,,,,,,Shin-ichi Yoshikawa,,,,,,,,,,,,,,,,,,,,,,,,,,
088.jpg,ex5-89,Island Cave,Trainer,,Hidden Legends,89,Uncommon,https://images.pokemontcg.io/ex5/89_hires.png,https://images.pokemontcg.io/ex5/89.png,,,,,,,,,,,Ken Ikuji,,,,,,,,,,,,,,,,,,,,,,,,,,
089.jpg,ex5-90,Life Herb,Trainer,,Hidden Legends,90,Uncommon,https://images.pokemontcg.io/ex5/90_hires.png,https://images.pokemontcg.io/ex5/90.png,,,,,,,,,,,Ryo Ueda,,,,,,,,,,,,,,,,,,,,,,,,,,
090.jpg,ex5-91,Magnetic Storm,Trainer,,Hidden Legends,91,Uncommon,https://images.pokemontcg.io/ex5/91_hires.png,https://images.pokemontcg.io/ex5/91.png,,,,,,,,,,,Shin-ichi Yoshikawa,,,,,,,,,,,,,,,,,,,,,,,,,,
091.jpg,ex5-92,Steven's Advice,Trainer,,Hidden Legends,92,Uncommon,https://images.pokemontcg.io/ex5/92_hires.png,https://images.pokemontcg.io/ex5/92.png,,,,,,,,,,,Ken Sugimori,,,,,,,,,,,,,,,,,,,,,,,,,,
092.jpg,ex5-93,Groudon ex,Pokémon,Fighting,Hidden Legends,93,Rare Holo EX,https://images.pokemontcg.io/ex5/93_hires.png,https://images.pokemontcg.io/ex5/93.png,100,"[{""name"": ""Mark of Antiquity"", ""text"": ""As long as Groudon ex is your Active Pokémon, each player's Kyogre ex and Rayquaza ex can't attack."", ""type"": ""Poké-Body""}]","[{""name"": ""Rock Tumble"", ""cost"": [""Colorless"", ""Colorless""], ""convertedEnergyCost"": 2, ""damage"": ""30"", ""text"": ""This attack's damage is not affected by Resistance.""}, {""name"": ""Crushing Mantle"", ""cost"": [""Fighting"", ""Fighting"", ""Colorless""], ""convertedEnergyCost"": 3, ""damage"": ""50+"", ""text"": ""You may discard from your hand as many Energy cards as you like. If you do, this attack does 50 damage plus 10 more damage for each Energy card you discarded.""}]",Rock Tumble|Crushing Mantle,30|50+,"This attack's damage is not affected by Resistance.|You may discard from your hand as many Energy cards as you like. If you do, this attack does 50 damage plus 10 more damage for each Energy card you discarded.",Water:×2,,Colorless__Colorless__Colorless,,Hikaru Koike,,,,,,,,,,,,,,,,,,,,,,,,,,
093.jpg,ex5-94,Kyogre ex,Pokémon,Water,Hidden Legends,94,Rare Holo EX,https://images.pokemontcg.io/ex5/94_hires.png,https://images.pokemontcg.io/ex5/94.png,100,"[{""name"": ""Mark of Antiquity"", ""text"": ""As long as Kyogre ex is your Active Pokémon, each player's Groudon ex and Rayquaza ex can't attack."", ""type"": ""Poké-Body""}]","[{""name"": ""Water Arrow"", ""cost"": [""Colorless"", ""Colorless""], ""convertedEnergyCost"": 2, ""damage"": """", ""text"": ""Choose 1 of your opponent's Pokémon. This attack does 20 damage to that Pokémon. (Don't apply Weakness and Resistance for Benched Pokémon.)""}, {""name"": ""Super Tidal Wave"", ""cost"": [""Water"", ""Water"", ""Colorless""], ""convertedEnergyCost"": 3, ""damage"": ""50+"", ""text"": ""You may show your hand to your opponent. If you do, this attack does 50 damage plus 10 more damage for each Energy card in your hand. After doing damage, shuffle the Energy cards back into your deck.""}]",Water Arrow|Super Tidal Wave,|50+,"Choose 1 of your opponent's Pokémon. This attack does 20 damage to that Pokémon. (Don't apply Weakness and Resistance for Benched Pokémon.)|You may show your hand to your opponent. If you do, this attack does 50 damage plus 10 more damage for each Energy card in your hand. After doing damage, shuffle the Energy cards back into your deck.",Grass:×2,,Colorless__Colorless__Colorless,,Hikaru Koike,,,,,,,,,,,,,,,,,,,,,,,,,,
