Image_Names,Card_ID,Card_Name,Super_Type,Types,Set_Name,Number,Rarity,Large_Image_URL,Small_Image_URL,HP,Abilities,Attacks_JSON,Attack_Names,Attack_Damages,Attack_Texts,Weaknesses,Resistances,Retreat_Cost,Evolves_From,Artist,FlavorText,Normal_low,Normal_mid,Normal_high,Normal_market,Normal_directLow,Holofoil_low,Holofoil_mid,Holofoil_high,Holofoil_market,Holofoil_directLow,ReverseHolofoil_low,ReverseHolofoil_mid,ReverseHolofoil_high,ReverseHolofoil_market,ReverseHolofoil_directLow,FirstEditionHolofoil_low,FirstEditionHolofoil_mid,FirstEditionHolofoil_high,FirstEditionHolofoil_market,FirstEditionHolofoil_directLow,FirstEditionNormal_low,FirstEditionNormal_mid,FirstEditionNormal_high,FirstEditionNormal_market,FirstEditionNormal_directLow
000.jpg,xy6-1,Exeggcute,Pokémon,Grass,Roaring Skies,1,Common,https://images.pokemontcg.io/xy6/1_hires.png,https://images.pokemontcg.io/xy6/1.png,40,,"[{""name"": ""Loathe"", ""cost"": [""Colorless""], ""convertedEnergyCost"": 1, ""damage"": """", ""text"": ""Flip a coin. If heads, switch this Pokémon with 1 of your Benched Pokémon.""}, {""name"": ""Ram"", ""cost"": [""Grass""], ""convertedEnergyCost"": 1, ""damage"": ""10"", ""text"": """"}]",Loathe|Ram,|10,"Flip a coin. If heads, switch this Pokémon with 1 of your Benched Pokémon.|",Fire:×2,,Colorless,,Tomokazu Komiya,"Even though it appears to be eggs of some sort, it was discovered to be a life-form more like plant seeds.",,,,,,,,,,,,,,,,,,,,,,,,,
001.jpg,xy6-2,Exeggutor,Pokémon,Grass,Roaring Skies,2,Uncommon,https://images.pokemontcg.io/xy6/2_hires.png,https://images.pokemontcg.io/xy6/2.png,120,,"[{""name"": ""Shake It Off"", ""cost"": [""Grass""], ""convertedEnergyCost"": 1, ""damage"": ""20×"", ""text"": ""This attack does 20 damage times the number of Colorless Pokémon your opponent has in play.""}, {""name"": ""Seed Bomb"", ""cost"": [""Grass"", ""Colorless"", ""Colorless""], ""convertedEnergyCost"": 3, ""damage"": ""80"", ""text"": """"}]",Shake It Off|Seed Bomb,20×|80,This attack does 20 damage times the number of Colorless Pokémon your opponent has in play.|,Fire:×2,,Colorless__Colorless__Colorless,Exeggcute,Shin Nagasawa,"It is called ""The Walking Jungle."" If a head grows too big, it falls off and becomes an Exeggcute.",,,,,,,,,,,,,,,,,,,,,,,,,
002.jpg,xy6-3,Wurmple,Pokémon,Grass,Roaring Skies,3,Common,https://images.pokemontcg.io/xy6/3_hires.png,https://images.pokemontcg.io/xy6/3.png,60,,"[{""name"": ""Flock"", ""cost"": [""Grass""], ""convertedEnergyCost"": 1, ""damage"": """", ""text"": ""Search your deck for Wurmple and put it onto your Bench. Shuffle your deck afterward.""}, {""name"": ""Tackle"", ""cost"": [""Colorless"", ""Colorless""], ""convertedEnergyCost"": 2, ""damage"": ""20"", ""text"": """"}]",Flock|Tackle,|20,Search your deck for Wurmple and put it onto your Bench. Shuffle your deck afterward.|,Fire:×2,,Colorless,,Naoyo Kimura,It lives among the tall grass and in forests. It repels attacks by raising up the spikes on its rear.,,,,,,,,,,,,,,,,,,,,,,,,,
003.jpg,xy6-4,Silcoon,Pokémon,Grass,Roaring Skies,4,Uncommon,https://images.pokemontcg.io/xy6/4_hires.png,https://images.pokemontcg.io/xy6/4.png,80,,"[{""name"": ""String Shot"", ""cost"": [""Grass""], ""convertedEnergyCost"": 1, ""damage"": ""10"", ""text"": ""Flip a coin. If heads, your opponent's Active Pokémon is now Paralyzed.""}]",String Shot,10,"Flip a coin. If heads, your opponent's Active Pokémon is now Paralyzed.",Fire:×2,,Colorless__Colorless__Colorless,Wurmple,Shigenori Negishi,It drinks dew that collects on its silk and waits for evolution. Its hard cocoon repels attacks.,,,,,,,,,,,,,,,,,,,,,,,,,
004.jpg,xy6-5,Beautifly,Pokémon,Grass,Roaring Skies,5,Rare Holo,https://images.pokemontcg.io/xy6/5_hires.png,https://images.pokemontcg.io/xy6/5.png,130,"[{""name"": ""Miraculous Scales"", ""text"": ""Prevent all damage done to this Pokémon by attacks from your opponent's Pokémon-EX."", ""type"": ""Ability""}]","[{""name"": ""Whirlwind"", ""cost"": [""Grass"", ""Colorless"", ""Colorless""], ""convertedEnergyCost"": 3, ""damage"": ""80"", ""text"": ""You may have your opponent switch his or her Active Pokémon with 1 of his or her Benched Pokémon.""}]",Whirlwind,80,You may have your opponent switch his or her Active Pokémon with 1 of his or her Benched Pokémon.,Fire:×2,,,Silcoon,Midori Harada,"It has an aggressive nature. It stabs prey with its long, narrow mouth to drain the prey's fluids.",,,,,,,,,,,,,,,,,,,,,,,,,
005.jpg,xy6-6,Cascoon,Pokémon,Grass,Roaring Skies,6,Common,https://images.pokemontcg.io/xy6/6_hires.png,https://images.pokemontcg.io/xy6/6.png,80,,"[{""name"": ""Poison Sting"", ""cost"": [""Grass""], ""convertedEnergyCost"": 1, ""damage"": """", ""text"": ""Your opponent's Active Pokémon is now Poisoned.""}, {""name"": ""Iron Defense"", ""cost"": [""Colorless"", ""Colorless""], ""convertedEnergyCost"": 2, ""damage"": """", ""text"": ""Flip a coin. If heads, prevent all damage done to this Pokémon by attacks during your opponent's next turn.""}]",Poison Sting|Iron Defense,|,"Your opponent's Active Pokémon is now Poisoned.|Flip a coin. If heads, prevent all damage done to this Pokémon by attacks during your opponent's next turn.",Fire:×2,,Colorless__Colorless__Colorless,Wurmple,MAHOU,"It never forgets any attack it endured while in the cocoon. After evolution, it seeks payback.",,,,,,,,,,,,,,,,,,,,,,,,,
006.jpg,xy6-7,Dustox,Pokémon,Grass,Roaring Skies,7,Uncommon,https://images.pokemontcg.io/xy6/7_hires.png,https://images.pokemontcg.io/xy6/7.png,140,,"[{""name"": ""Psybeam"", ""cost"": [""Colorless"", ""Colorless""], ""convertedEnergyCost"": 2, ""damage"": ""30"", ""text"": ""Your opponent's Active Pokémon is now Confused.""}, {""name"": ""Twilight Poison"", ""cost"": [""Grass"", ""Grass"", ""Colorless"", ""Colorless""], ""convertedEnergyCost"": 4, ""damage"": ""80"", ""text"": ""Your opponent's Active Pokémon is now Asleep and Poisoned.""}]",Psybeam|Twilight Poison,30|80,Your opponent's Active Pokémon is now Confused.|Your opponent's Active Pokémon is now Asleep and Poisoned.,Fire:×2,,Colorless__Colorless,Cascoon,Akira Komayama,It violently flutters its wings to scatter toxic dust when attacked. It becomes active after sunset.,,,,,,,,,,,,,,,,,,,,,,,,,
007.jpg,xy6-8,Dustox,Pokémon,Grass,Roaring Skies,8,Rare,https://images.pokemontcg.io/xy6/8_hires.png,https://images.pokemontcg.io/xy6/8.png,130,,"[{""name"": ""Flap"", ""cost"": [""Grass""], ""convertedEnergyCost"": 1, ""damage"": ""20"", ""text"": """"}, {""name"": ""Wind Shard"", ""cost"": [""Grass"", ""Colorless"", ""Colorless""], ""convertedEnergyCost"": 3, ""damage"": """", ""text"": ""This attack does 50 damage to 1 of your opponent's Benched Pokémon. (Don't apply Weakness and Resistance for Benched Pokémon.)""}]",Flap|Wind Shard,20|,|This attack does 50 damage to 1 of your opponent's Benched Pokémon. (Don't apply Weakness and Resistance for Benched Pokémon.),Fire:×2,,Colorless,Cascoon,match,It violently flutters its wings to scatter toxic dust when attacked. It becomes active after sunset.,,,,,,,,,,,,,,,,,,,,,,,,,
008.jpg,xy6-9,Nincada,Pokémon,Grass,Roaring Skies,9,Common,https://images.pokemontcg.io/xy6/9_hires.png,https://images.pokemontcg.io/xy6/9.png,40,,"[{""name"": ""Slight Intrusion"", ""cost"": [""Colorless""], ""convertedEnergyCost"": 1, ""damage"": ""20"", ""text"": ""This Pokémon does 10 damage to itself.""}]",Slight Intrusion,20,This Pokémon does 10 damage to itself.,Fire:×2,,Colorless,,Kyoko Umemoto,It can sometimes live underground for more than 10 years. It absorbs nutrients from the roots of trees.,,,,,,,,,,,,,,,,,,,,,,,,,
009.jpg,xy6-10,Ninjask,Pokémon,Grass,Roaring Skies,10,Uncommon,https://images.pokemontcg.io/xy6/10_hires.png,https://images.pokemontcg.io/xy6/10.png,70,"[{""name"": ""Wing Buzz"", ""text"": ""Once during your turn (before your attack), if this Pokémon is your Active Pokémon, you may discard a card from your hand. If you do, discard the top card of your opponent's deck."", ""type"": ""Ability""}]","[{""name"": ""Afterimage Assault"", ""cost"": [""Grass"", ""Colorless""], ""convertedEnergyCost"": 2, ""damage"": ""30"", ""text"": ""Search your deck for up to 2 Ninjask and put them onto your Bench. Shuffle your deck afterward.""}]",Afterimage Assault,30,Search your deck for up to 2 Ninjask and put them onto your Bench. Shuffle your deck afterward.,Fire:×2,,,Nincada,Sumiyoshi Kizuki,"Because it moves so quickly, it sometimes becomes unseeable. It congregates around tree sap.",,,,,,,,,,,,,,,,,,,,,,,,,
010.jpg,xy6-11,Shedinja,Pokémon,Grass,Roaring Skies,11,Rare,https://images.pokemontcg.io/xy6/11_hires.png,https://images.pokemontcg.io/xy6/11.png,30,,"[{""name"": ""Cursed Rain"", ""cost"": [""Grass""], ""convertedEnergyCost"": 1, ""damage"": """", ""text"": ""Put 1 damage counter on each of your opponent's Pokémon. Switch this Pokémon with 1 of your Benched Pokémon.""}, {""name"": ""Hopeless Scream"", ""cost"": [""Colorless""], ""convertedEnergyCost"": 1, ""damage"": ""50×"", ""text"": ""This attack does 50 damage times the number of damage counters on this Pokémon.""}]",Cursed Rain|Hopeless Scream,|50×,Put 1 damage counter on each of your opponent's Pokémon. Switch this Pokémon with 1 of your Benched Pokémon.|This attack does 50 damage times the number of damage counters on this Pokémon.,,,Colorless,Nincada,Aya Kusube,A most peculiar Pokémon that somehow appears in a Poké Ball when a Nincada evolves.,,,,,,,,,,,,,,,,,,,,,,,,,
011.jpg,xy6-12,Tropius,Pokémon,Grass,Roaring Skies,12,Uncommon,https://images.pokemontcg.io/xy6/12_hires.png,https://images.pokemontcg.io/xy6/12.png,110,,"[{""name"": ""Stomp"", ""cost"": [""Colorless"", ""Colorless"", ""Colorless""], ""convertedEnergyCost"": 3, ""damage"": ""50+"", ""text"": ""Flip a coin. If heads, this attack does 20 more damage.""}, {""name"": ""Solar Beam"", ""cost"": [""Grass"", ""Colorless"", ""Colorless"", ""Colorless""], ""convertedEnergyCost"": 4, ""damage"": ""80"", ""text"": """"}]",Stomp|Solar Beam,50+|80,"Flip a coin. If heads, this attack does 20 more damage.|",Fire:×2,,Colorless__Colorless,,Kyoko Umemoto,The bunch of fruit around its neck ripens twice a year and is delicious. It's a highly favored tropical snack.,,,,,,,,,,,,,,,,,,,,,,,,,
012.jpg,xy6-13,Victini,Pokémon,Fire,Roaring Skies,13,Rare,https://images.pokemontcg.io/xy6/13_hires.png,https://images.pokemontcg.io/xy6/13.png,70,,"[{""name"": ""Me First"", ""cost"": [""Colorless""], ""convertedEnergyCost"": 1, ""damage"": """", ""text"": ""Draw a card.""}, {""name"": ""Psy Bolt"", ""cost"": [""Fire"", ""Colorless""], ""convertedEnergyCost"": 2, ""damage"": ""20"", ""text"": ""Flip a coin. If heads, your opponent's Active Pokémon is now Paralyzed.""}]",Me First|Psy Bolt,|20,"Draw a card.|Flip a coin. If heads, your opponent's Active Pokémon is now Paralyzed.",Water:×2,,Colorless,,Kouki Saitou,"When it shares the infinite energy it creates, that being's entire body will be overflowing with power.",,,,,,,,,,,,,,,,,,,,,,,,,
013.jpg,xy6-14,Fletchinder,Pokémon,Fire,Roaring Skies,14,Uncommon,https://images.pokemontcg.io/xy6/14_hires.png,https://images.pokemontcg.io/xy6/14.png,70,,"[{""name"": ""Peck Off"", ""cost"": [""Colorless""], ""convertedEnergyCost"": 1, ""damage"": ""10"", ""text"": ""Before doing damage, discard all Pokémon Tool cards attached to your opponent's Active Pokémon.""}]",Peck Off,10,"Before doing damage, discard all Pokémon Tool cards attached to your opponent's Active Pokémon.",Water:×2,,,Fletchling,Naoyo Kimura,"The hotter the flame sac on its belly, the faster it can fly, but it takes some time to get the fire going.",,,,,,,,,,,,,,,,,,,,,,,,,
014.jpg,xy6-15,Talonflame,Pokémon,Fire,Roaring Skies,15,Rare,https://images.pokemontcg.io/xy6/15_hires.png,https://images.pokemontcg.io/xy6/15.png,130,,"[{""name"": ""Grand Loop"", ""cost"": [""Colorless""], ""convertedEnergyCost"": 1, ""damage"": """", ""text"": ""Draw 3 cards. You may switch this Pokémon with 1 of your Benched Pokémon.""}, {""name"": ""Brave Bird"", ""cost"": [""Fire"", ""Colorless""], ""convertedEnergyCost"": 2, ""damage"": ""90"", ""text"": ""This Pokémon does 20 damage to itself.""}]",Grand Loop|Brave Bird,|90,Draw 3 cards. You may switch this Pokémon with 1 of your Benched Pokémon.|This Pokémon does 20 damage to itself.,Water:×2,,,Fletchinder,Masakazu Fukuda,"When attacking prey, it can reach speeds of up to 310 mph. It finishes its prey off with a colossal kick.",,,,,,,,,,,,,,,,,,,,,,,,,
015.jpg,xy6-16,Articuno,Pokémon,Water,Roaring Skies,16,Rare,https://images.pokemontcg.io/xy6/16_hires.png,https://images.pokemontcg.io/xy6/16.png,120,,"[{""name"": ""Find Ice"", ""cost"": [""Water""], ""convertedEnergyCost"": 1, ""damage"": """", ""text"": ""Search your deck for up to 3 Water Energy cards, reveal them, and put them into your hand. Shuffle your deck afterward.""}, {""name"": ""Freezing Wind"", ""cost"": [""Water"", ""Water"", ""Colorless"", ""Colorless""], ""convertedEnergyCost"": 4, ""damage"": ""100"", ""text"": """"}]",Find Ice|Freezing Wind,|100,"Search your deck for up to 3 Water Energy cards, reveal them, and put them into your hand. Shuffle your deck afterward.|",Metal:×2,Fighting:-20,Colorless,,Naoki Saito,A legendary bird Pokémon that is said to appear to doomed people who are lost in icy mountains.,,,,,,,,,,,,,,,,,,,,,,,,,
016.jpg,xy6-17,Articuno,Pokémon,Water,Roaring Skies,17,Rare,https://images.pokemontcg.io/xy6/17_hires.png,https://images.pokemontcg.io/xy6/17.png,120,,"[{""name"": ""Chilling Sigh"", ""cost"": [""Water""], ""convertedEnergyCost"": 1, ""damage"": """", ""text"": ""Your opponent's Active Pokémon is now Asleep.""}, {""name"": ""Tri Edge"", ""cost"": [""Water"", ""Water"", ""Colorless""], ""convertedEnergyCost"": 3, ""damage"": ""20+"", ""text"": ""Flip 3 coins. This attack does 40 more damage for each heads.""}]",Chilling Sigh|Tri Edge,|20+,Your opponent's Active Pokémon is now Asleep.|Flip 3 coins. This attack does 40 more damage for each heads.,Metal:×2,Fighting:-20,Colorless__Colorless,,5ban Graphics,A legendary bird Pokémon that is said to appear to doomed people who are lost in icy mountains.,,,,,,,,,,,,,,,,,,,,,,,,,
017.jpg,xy6-18,Wingull,Pokémon,Water,Roaring Skies,18,Common,https://images.pokemontcg.io/xy6/18_hires.png,https://images.pokemontcg.io/xy6/18.png,60,,"[{""name"": ""Water Gun"", ""cost"": [""Water""], ""convertedEnergyCost"": 1, ""damage"": ""10"", ""text"": """"}]",Water Gun,10,,Lightning:×2,Fighting:-20,Colorless,,MAHOU,"It makes its nest on steep sea cliffs. Riding updrafts, it soars to great heights.",,,,,,,,,,,,,,,,,,,,,,,,,
018.jpg,xy6-19,Pelipper,Pokémon,Water,Roaring Skies,19,Uncommon,https://images.pokemontcg.io/xy6/19_hires.png,https://images.pokemontcg.io/xy6/19.png,100,,"[{""name"": ""Swallow"", ""cost"": [""Water"", ""Colorless""], ""convertedEnergyCost"": 2, ""damage"": ""30"", ""text"": ""Heal from this Pokémon the same amount of damage you did to your opponent's Active Pokémon.""}, {""name"": ""Water Pulse"", ""cost"": [""Water"", ""Colorless"", ""Colorless"", ""Colorless""], ""convertedEnergyCost"": 4, ""damage"": ""70"", ""text"": ""Your opponent's Active Pokémon is now Asleep.""}]",Swallow|Water Pulse,30|70,Heal from this Pokémon the same amount of damage you did to your opponent's Active Pokémon.|Your opponent's Active Pokémon is now Asleep.,Lightning:×2,Fighting:-20,Colorless__Colorless,Wingull,Midori Harada,"It is a messenger of the skies, carrying small Pokémon and eggs to safety in its bill.",,,,,,,,,,,,,,,,,,,,,,,,,
019.jpg,xy6-20,Pikachu,Pokémon,Lightning,Roaring Skies,20,Common,https://images.pokemontcg.io/xy6/20_hires.png,https://images.pokemontcg.io/xy6/20.png,60,,"[{""name"": ""Tail Whip"", ""cost"": [""Colorless""], ""convertedEnergyCost"": 1, ""damage"": """", ""text"": ""Flip a coin. If heads, the Defending Pokémon can't attack during your opponent's next turn.""}, {""name"": ""Electro Ball"", ""cost"": [""Lightning"", ""Colorless""], ""convertedEnergyCost"": 2, ""damage"": ""30"", ""text"": """"}]",Tail Whip|Electro Ball,|30,"Flip a coin. If heads, the Defending Pokémon can't attack during your opponent's next turn.|",Fighting:×2,Metal:-20,Colorless,,Naoki Saito,It raises its tail to check its surroundings. The tail is sometimes struck by lightning in this pose.,,,,,,,,,,,,,,,,,,,,,,,,,
020.jpg,xy6-21,Voltorb,Pokémon,Lightning,Roaring Skies,21,Common,https://images.pokemontcg.io/xy6/21_hires.png,https://images.pokemontcg.io/xy6/21.png,60,,"[{""name"": ""Thunder Wave"", ""cost"": [""Lightning""], ""convertedEnergyCost"": 1, ""damage"": """", ""text"": ""Flip a coin. If heads, your opponent's Active Pokémon is now Paralyzed.""}, {""name"": ""Big Explosion"", ""cost"": [""Lightning"", ""Colorless""], ""convertedEnergyCost"": 2, ""damage"": ""60"", ""text"": ""This Pokémon does 60 damage to itself.""}]",Thunder Wave|Big Explosion,|60,"Flip a coin. If heads, your opponent's Active Pokémon is now Paralyzed.|This Pokémon does 60 damage to itself.",Fighting:×2,Metal:-20,Colorless,,Suwama Chiaki,"Usually found in power plants. Easily mistaken for a Poké Ball, it has zapped many people.",,,,,,,,,,,,,,,,,,,,,,,,,
021.jpg,xy6-22,Electrode,Pokémon,Lightning,Roaring Skies,22,Uncommon,https://images.pokemontcg.io/xy6/22_hires.png,https://images.pokemontcg.io/xy6/22.png,90,,"[{""name"": ""Continuous Tumble"", ""cost"": [""Colorless""], ""convertedEnergyCost"": 1, ""damage"": ""20×"", ""text"": ""Flip a coin until you get tails. This attack does 20 damage times the number of heads.""}, {""name"": ""Energy Bomb"", ""cost"": [""Lightning"", ""Colorless"", ""Colorless""], ""convertedEnergyCost"": 3, ""damage"": ""70"", ""text"": ""You may move all Energy from this Pokémon to your Benched Pokémon in any way you like.""}]",Continuous Tumble|Energy Bomb,20×|70,Flip a coin until you get tails. This attack does 20 damage times the number of heads.|You may move all Energy from this Pokémon to your Benched Pokémon in any way you like.,Fighting:×2,Metal:-20,Colorless,Voltorb,Tomokazu Komiya,It stores an overflowing amount of electric energy inside its body. Even a small shock makes it explode.,,,,,,,,,,,,,,,,,,,,,,,,,
022.jpg,xy6-23,Zapdos,Pokémon,Lightning,Roaring Skies,23,Rare,https://images.pokemontcg.io/xy6/23_hires.png,https://images.pokemontcg.io/xy6/23.png,120,,"[{""name"": ""Drill Peck"", ""cost"": [""Lightning""], ""convertedEnergyCost"": 1, ""damage"": ""20"", ""text"": """"}, {""name"": ""Raging Thunder"", ""cost"": [""Lightning"", ""Lightning"", ""Colorless""], ""convertedEnergyCost"": 3, ""damage"": ""120"", ""text"": ""This attack does 40 damage to 1 of your Benched Pokémon. (Don't apply Weakness and Resistance for Benched Pokémon.)""}]",Drill Peck|Raging Thunder,20|120,|This attack does 40 damage to 1 of your Benched Pokémon. (Don't apply Weakness and Resistance for Benched Pokémon.),Lightning:×2,Fighting:-20,Colorless__Colorless,,Hitoshi Ariga,A legendary Pokémon that is said to live in thunderclouds. It freely controls lightning bolts.,,,,,,,,,,,,,,,,,,,,,,,,,
023.jpg,xy6-24,Electrike,Pokémon,Lightning,Roaring Skies,24,Common,https://images.pokemontcg.io/xy6/24_hires.png,https://images.pokemontcg.io/xy6/24.png,60,,"[{""name"": ""Bite"", ""cost"": [""Colorless""], ""convertedEnergyCost"": 1, ""damage"": ""10"", ""text"": """"}]",Bite,10,,Fighting:×2,Metal:-20,Colorless,,Akira Komayama,It stores static electricity in its fur for discharging. It gives off sparks if a storm approaches.,,,,,,,,,,,,,,,,,,,,,,,,,
024.jpg,xy6-25,Manectric,Pokémon,Lightning,Roaring Skies,25,Uncommon,https://images.pokemontcg.io/xy6/25_hires.png,https://images.pokemontcg.io/xy6/25.png,90,,"[{""name"": ""Random Spark"", ""cost"": [""Lightning""], ""convertedEnergyCost"": 1, ""damage"": """", ""text"": ""This attack does 30 damage to 1 of your opponent's Pokémon. (Don't apply Weakness and Resistance for Benched Pokémon.)""}, {""name"": ""Bite"", ""cost"": [""Colorless"", ""Colorless""], ""convertedEnergyCost"": 2, ""damage"": ""40"", ""text"": """"}]",Random Spark|Bite,|40,This attack does 30 damage to 1 of your opponent's Pokémon. (Don't apply Weakness and Resistance for Benched Pokémon.)|,Fighting:×2,Metal:-20,Colorless,Electrike,match,It discharges electricity from its mane. It creates a thundercloud overhead to drop lightning bolts.,,,,,,,,,,,,,,,,,,,,,,,,,
025.jpg,xy6-26,Thundurus-EX,Pokémon,Lightning,Roaring Skies,26,Rare Holo EX,https://images.pokemontcg.io/xy6/26_hires.png,https://images.pokemontcg.io/xy6/26.png,170,,"[{""name"": ""Headlock"", ""cost"": [""Lightning"", ""Colorless""], ""convertedEnergyCost"": 2, ""damage"": ""30+"", ""text"": ""Flip a coin. If heads, this attack does 30 more damage. If tails, your opponent's Active Pokémon is now Paralyzed.""}, {""name"": ""Voltage Rush"", ""cost"": [""Lightning"", ""Lightning"", ""Lightning""], ""convertedEnergyCost"": 3, ""damage"": ""150"", ""text"": ""This Pokémon does 50 damage to itself.""}]",Headlock|Voltage Rush,30+|150,"Flip a coin. If heads, this attack does 30 more damage. If tails, your opponent's Active Pokémon is now Paralyzed.|This Pokémon does 50 damage to itself.",Fighting:×2,Metal:-20,Colorless__Colorless,,Eske Yoshinob,,,,,,,,,,,,,,,,,,,,,,,,,,
026.jpg,xy6-27,Natu,Pokémon,Psychic,Roaring Skies,27,Common,https://images.pokemontcg.io/xy6/27_hires.png,https://images.pokemontcg.io/xy6/27.png,50,,"[{""name"": ""Peck"", ""cost"": [""Colorless""], ""convertedEnergyCost"": 1, ""damage"": ""10"", ""text"": """"}]",Peck,10,,Psychic:×2,,Colorless,,Atsuko Nishida,"It usually forages for food on the ground but may, on rare occasions, hop onto branches to peck at shoots.",,,,,,,,,,,,,,,,,,,,,,,,,
027.jpg,xy6-28,Natu,Pokémon,Psychic,Roaring Skies,28,Common,https://images.pokemontcg.io/xy6/28_hires.png,https://images.pokemontcg.io/xy6/28.png,40,,"[{""name"": ""Psywave"", ""cost"": [""Psychic"", ""Colorless""], ""convertedEnergyCost"": 2, ""damage"": ""10×"", ""text"": ""This attack does 10 damage times the amount of Energy attached to your opponent's Active Pokémon.""}]",Psywave,10×,This attack does 10 damage times the amount of Energy attached to your opponent's Active Pokémon.,Psychic:×2,,Colorless,,Kagemaru Himeno,"It usually forages for food on the ground but may, on rare occasions, hop onto branches to peck at shoots.",,,,,,,,,,,,,,,,,,,,,,,,,
028.jpg,xy6-29,Xatu,Pokémon,Psychic,Roaring Skies,29,Rare,https://images.pokemontcg.io/xy6/29_hires.png,https://images.pokemontcg.io/xy6/29.png,90,,"[{""name"": ""Future Sight"", ""cost"": [""Colorless""], ""convertedEnergyCost"": 1, ""damage"": """", ""text"": ""Look at the top 5 cards of either player's deck and put them back on top of that player's deck in any order.""}, {""name"": ""Stressful Eye"", ""cost"": [""Psychic"", ""Colorless""], ""convertedEnergyCost"": 2, ""damage"": ""30"", ""text"": ""Your opponent reveals his or her hand. Discard a Trainer card you find there.""}]",Future Sight|Stressful Eye,|30,Look at the top 5 cards of either player's deck and put them back on top of that player's deck in any order.|Your opponent reveals his or her hand. Discard a Trainer card you find there.,Psychic:×2,,Colorless,Natu,Hajime Kusajima,They say that it stays still and quiet because it is seeing both the past and future at the same time.,,,,,,,,,,,,,,,,,,,,,,,,,
029.jpg,xy6-30,Shuppet,Pokémon,Psychic,Roaring Skies,30,Common,https://images.pokemontcg.io/xy6/30_hires.png,https://images.pokemontcg.io/xy6/30.png,60,,"[{""name"": ""Bleh"", ""cost"": [""Psychic""], ""convertedEnergyCost"": 1, ""damage"": """", ""text"": ""Discard a Special Energy attached to 1 of your opponent's Pokémon.""}]",Bleh,,Discard a Special Energy attached to 1 of your opponent's Pokémon.,Darkness:×2,Fighting:-20,Colorless,,Yukiko Baba,It loves vengeful emotions and hangs in rows under the eaves of houses where vengeful people live.,,,,,,,,,,,,,,,,,,,,,,,,,
030.jpg,xy6-31,Banette,Pokémon,Psychic,Roaring Skies,31,Rare,https://images.pokemontcg.io/xy6/31_hires.png,https://images.pokemontcg.io/xy6/31.png,80,"[{""name"": ""Tool Concealment"", ""text"": ""Each Pokémon Tool card in play has no effect."", ""type"": ""Ability""}]","[{""name"": ""Psyshot"", ""cost"": [""Psychic"", ""Colorless"", ""Colorless""], ""convertedEnergyCost"": 3, ""damage"": ""60"", ""text"": """"}]",Psyshot,60,,Darkness:×2,Fighting:-20,Colorless,Shuppet,Aya Kusube,"Strong feelings of hatred turned a puppet into a Pokémon. If it opens its mouth, its cursed energy escapes.",,,,,,,,,,,,,,,,,,,,,,,,,
031.jpg,xy6-32,Banette,Pokémon,Psychic,Roaring Skies,32,Rare,https://images.pokemontcg.io/xy6/32_hires.png,https://images.pokemontcg.io/xy6/32.png,90,,"[{""name"": ""Evolution Jammer"", ""cost"": [""Psychic""], ""convertedEnergyCost"": 1, ""damage"": ""20"", ""text"": ""Your opponent can't play any Pokémon from his or her hand to evolve his or her Pokémon during his or her next turn.""}, {""name"": ""Curse Deeply"", ""cost"": [""Psychic"", ""Colorless""], ""convertedEnergyCost"": 2, ""damage"": """", ""text"": ""Put 5 damage counters on your opponent's Active Pokémon.""}]",Evolution Jammer|Curse Deeply,20|,Your opponent can't play any Pokémon from his or her hand to evolve his or her Pokémon during his or her next turn.|Put 5 damage counters on your opponent's Active Pokémon.,Darkness:×2,Fighting:-20,Colorless,Shuppet,Shin Nagasawa,"Strong feelings of hatred turned a puppet into a Pokémon. If it opens its mouth, its cursed energy escapes.",,,,,,,,,,,,,,,,,,,,,,,,,
