Image_Names,Card_ID,Card_Name,Super_Type,Types,Set_Name,Number,Rarity,Large_Image_URL,Small_Image_URL,HP,Abilities,Attacks_JSON,Attack_Names,Attack_Damages,Attack_Texts,Weaknesses,Resistances,Retreat_Cost,Evolves_From,Artist,FlavorText,Normal_low,Normal_mid,Normal_high,Normal_market,Normal_directLow,Holofoil_low,Holofoil_mid,Holofoil_high,Holofoil_market,Holofoil_directLow,ReverseHolofoil_low,ReverseHolofoil_mid,ReverseHolofoil_high,ReverseHolofoil_market,ReverseHolofoil_directLow,FirstEditionHolofoil_low,FirstEditionHolofoil_mid,FirstEditionHolofoil_high,FirstEditionHolofoil_market,FirstEditionHolofoil_directLow,FirstEditionNormal_low,FirstEditionNormal_mid,FirstEditionNormal_high,FirstEditionNormal_market,FirstEditionNormal_directLow
109.jpg,pl3-110,Magikarp,Pokémon,Water,Supreme Victors,110,Common,https://images.pokemontcg.io/pl3/110_hires.png,https://images.pokemontcg.io/pl3/110.png,30,,"[{""name"": ""Flail Around"", ""cost"": [""Colorless""], ""convertedEnergyCost"": 1, ""damage"": ""10×"", ""text"": ""Flip 3 coins. This attack does 10 damage times the number of heads.""}]",Flail Around,10×,Flip 3 coins. This attack does 10 damage times the number of heads.,Lightning:+10,,Colorless,,Masakazu Fukuda,"A Magikarp living for many years can leap a mountain using Splash. The move remains useless, though.",,,,,,,,,,,,,,,,,,,,,,,,,
110.jpg,pl3-111,Magnemite,Pokémon,Lightning,Supreme Victors,111,Common,https://images.pokemontcg.io/pl3/111_hires.png,https://images.pokemontcg.io/pl3/111.png,40,,"[{""name"": ""Speed Ball"", ""cost"": [""Colorless""], ""convertedEnergyCost"": 1, ""damage"": ""10"", ""text"": """"}, {""name"": ""Quick Attack"", ""cost"": [""Colorless"", ""Colorless""], ""convertedEnergyCost"": 2, ""damage"": ""10+"", ""text"": ""Flip a coin. If heads, this attack does 10 damage plus 20 more damage.""}]",Speed Ball|Quick Attack,10|10+,"|Flip a coin. If heads, this attack does 10 damage plus 20 more damage.",Fighting:+10,Metal:-20,Colorless,,Masakazu Fukuda,"The faster the units at its sides rotate, the greater the magnetic force they generate.",,,,,,,,,,,,,,,,,,,,,,,,,
111.jpg,pl3-112,Mankey,Pokémon,Fighting,Supreme Victors,112,Common,https://images.pokemontcg.io/pl3/112_hires.png,https://images.pokemontcg.io/pl3/112.png,50,,"[{""name"": ""Extra Punch"", ""cost"": [""Fighting""], ""convertedEnergyCost"": 1, ""damage"": ""10+"", ""text"": ""If the Defending Pokémon is a Pokémon LV.X, this attack does 10 damage plus 50 more damage.""}]",Extra Punch,10+,"If the Defending Pokémon is a Pokémon LV.X, this attack does 10 damage plus 50 more damage.",Psychic:+10,,Colorless,,Kanako Eo,"It lives in treetop colonies. If one becomes enraged, the whole colony rampages for no reason.",,,,,,,,,,,,,,,,,,,,,,,,,
112.jpg,pl3-113,Meditite,Pokémon,Psychic,Supreme Victors,113,Common,https://images.pokemontcg.io/pl3/113_hires.png,https://images.pokemontcg.io/pl3/113.png,60,,"[{""name"": ""Psyshot"", ""cost"": [""Colorless""], ""convertedEnergyCost"": 1, ""damage"": ""10"", ""text"": """"}, {""name"": ""Karate Chop"", ""cost"": [""Psychic"", ""Colorless""], ""convertedEnergyCost"": 2, ""damage"": ""30-"", ""text"": ""Does 30 damage minus 10 damage for each damage counter on Meditite.""}]",Psyshot|Karate Chop,10|30-,|Does 30 damage minus 10 damage for each damage counter on Meditite.,Psychic:+10,,Colorless,,Kagemaru Himeno,It always trains deep in mountains. It levitates when it heightens its spiritual power through meditation.,,,,,,,,,,,,,,,,,,,,,,,,,
113.jpg,pl3-114,Meowth,Pokémon,Colorless,Supreme Victors,114,Common,https://images.pokemontcg.io/pl3/114_hires.png,https://images.pokemontcg.io/pl3/114.png,60,,"[{""name"": ""Scratch"", ""cost"": [""Colorless""], ""convertedEnergyCost"": 1, ""damage"": ""10"", ""text"": """"}, {""name"": ""Double Kick"", ""cost"": [""Colorless"", ""Colorless"", ""Colorless""], ""convertedEnergyCost"": 3, ""damage"": ""20×"", ""text"": ""Flip 2 coins. This attack does 20 damage times the number of heads.""}]",Scratch|Double Kick,10|20×,|Flip 2 coins. This attack does 20 damage times the number of heads.,Fighting:+10,,Colorless,,Kouki Saitou,"It is nocturnal in nature. If it spots something shiny, its eyes glitter brightly.",,,,,,,,,,,,,,,,,,,,,,,,,
114.jpg,pl3-115,Mime Jr.,Pokémon,Psychic,Supreme Victors,115,Common,https://images.pokemontcg.io/pl3/115_hires.png,https://images.pokemontcg.io/pl3/115.png,50,"[{""name"": ""Baby Evolution"", ""text"": ""Once during your turn (before your attack), you may put Mr. Mime from your hand onto Mime Jr. (this counts as evolving Mime Jr.) and remove all damage counters from Mime Jr."", ""type"": ""Poké-Power""}]","[{""name"": ""Encore"", ""cost"": [""Colorless""], ""convertedEnergyCost"": 1, ""damage"": """", ""text"": ""Choose 1 of the Defending Pokémon's attacks. That Pokémon can use only that attack during your opponent's next turn.""}]",Encore,,Choose 1 of the Defending Pokémon's attacks. That Pokémon can use only that attack during your opponent's next turn.,Psychic:+10,,Colorless,,Miki Tanaka,It mimics the expressions and motions of those it sees to understand the feelings of others.,,,,,,,,,,,,,,,,,,,,,,,,,
115.jpg,pl3-116,Mudkip,Pokémon,Water,Supreme Victors,116,Common,https://images.pokemontcg.io/pl3/116_hires.png,https://images.pokemontcg.io/pl3/116.png,60,,"[{""name"": ""Mud Sport"", ""cost"": [""Water""], ""convertedEnergyCost"": 1, ""damage"": ""10+"", ""text"": ""If Mudkip has less Energy attached to it than the Defending Pokémon, this attack does 10 damage plus 10 more damage.""}, {""name"": ""Surf"", ""cost"": [""Water"", ""Colorless""], ""convertedEnergyCost"": 2, ""damage"": ""20"", ""text"": """"}]",Mud Sport|Surf,10+|20,"If Mudkip has less Energy attached to it than the Defending Pokémon, this attack does 10 damage plus 10 more damage.|",Grass:+10,,Colorless,,Kouki Saitou,"To alert it, the fin on its head senses the flow of water. It has the strength to heft boulders.",,,,,,,,,,,,,,,,,,,,,,,,,
116.jpg,pl3-117,Nincada,Pokémon,Grass,Supreme Victors,117,Common,https://images.pokemontcg.io/pl3/117_hires.png,https://images.pokemontcg.io/pl3/117.png,40,,"[{""name"": ""Call for Family"", ""cost"": [""Colorless""], ""convertedEnergyCost"": 1, ""damage"": """", ""text"": ""Search your deck for a Basic Pokémon and put it onto your Bench. Shuffle your deck afterward.""}, {""name"": ""Dash Attack"", ""cost"": [""Colorless""], ""convertedEnergyCost"": 1, ""damage"": """", ""text"": ""Choose 1 of your opponent's Benched Pokémon. This attack does 10 damage to that Pokémon. (Don't apply Weakness and Resistance for Benched Pokémon.)""}]",Call for Family|Dash Attack,|,Search your deck for a Basic Pokémon and put it onto your Bench. Shuffle your deck afterward.|Choose 1 of your opponent's Benched Pokémon. This attack does 10 damage to that Pokémon. (Don't apply Weakness and Resistance for Benched Pokémon.),Fire:+10,,Colorless,,Tomokazu Komiya,"It grows underground, sensing its surroundings using antennae instead of its virtually blind eyes.",,,,,,,,,,,,,,,,,,,,,,,,,
117.jpg,pl3-118,Pachirisu,Pokémon,Lightning,Supreme Victors,118,Common,https://images.pokemontcg.io/pl3/118_hires.png,https://images.pokemontcg.io/pl3/118.png,60,,"[{""name"": ""Tail Slap"", ""cost"": [""Colorless""], ""convertedEnergyCost"": 1, ""damage"": ""10"", ""text"": """"}, {""name"": ""Pachi"", ""cost"": [""Lightning""], ""convertedEnergyCost"": 1, ""damage"": ""10+"", ""text"": ""Flip a coin. If heads, this attack does 10 damage plus 10 more damage.""}]",Tail Slap|Pachi,10|10+,"|Flip a coin. If heads, this attack does 10 damage plus 10 more damage.",Fighting:+10,Metal:-20,Colorless,,Kagemaru Himeno,A pair may be seen rubbing their cheek pouches together in an effort to share stored electricity.,,,,,,,,,,,,,,,,,,,,,,,,,
118.jpg,pl3-119,Paras,Pokémon,Grass,Supreme Victors,119,Common,https://images.pokemontcg.io/pl3/119_hires.png,https://images.pokemontcg.io/pl3/119.png,50,,"[{""name"": ""Spore"", ""cost"": [""Colorless""], ""convertedEnergyCost"": 1, ""damage"": """", ""text"": ""The Defending Pokémon is now Asleep.""}, {""name"": ""Stomp"", ""cost"": [""Grass""], ""convertedEnergyCost"": 1, ""damage"": ""10+"", ""text"": ""Flip a coin. If heads, this attack does 10 damage plus 10 more damage.""}]",Spore|Stomp,|10+,"The Defending Pokémon is now Asleep.|Flip a coin. If heads, this attack does 10 damage plus 10 more damage.",Fire:+10,,Colorless,,Yukiko Baba,Mushrooms named tochukaso grow on its back. They grow along with the host Paras.,,,,,,,,,,,,,,,,,,,,,,,,,
119.jpg,pl3-120,Pikachu,Pokémon,Lightning,Supreme Victors,120,Common,https://images.pokemontcg.io/pl3/120_hires.png,https://images.pokemontcg.io/pl3/120.png,50,,"[{""name"": ""Gnaw"", ""cost"": [""Colorless""], ""convertedEnergyCost"": 1, ""damage"": ""10"", ""text"": """"}, {""name"": ""Thundershock"", ""cost"": [""Lightning"", ""Colorless""], ""convertedEnergyCost"": 2, ""damage"": ""20"", ""text"": ""Flip a coin. If heads, the Defending Pokémon is now Paralyzed.""}]",Gnaw|Thundershock,10|20,"|Flip a coin. If heads, the Defending Pokémon is now Paralyzed.",Fighting:+10,Metal:-20,Colorless,,Takao Unno,It occasionally uses an electric shock to recharge a fellow Pikachu that is in a weakened state.,,,,,,,,,,,,,,,,,,,,,,,,,
120.jpg,pl3-121,Piplup,Pokémon,Water,Supreme Victors,121,Common,https://images.pokemontcg.io/pl3/121_hires.png,https://images.pokemontcg.io/pl3/121.png,60,,"[{""name"": ""Pound"", ""cost"": [""Colorless""], ""convertedEnergyCost"": 1, ""damage"": ""10"", ""text"": """"}, {""name"": ""Surf"", ""cost"": [""Water"", ""Colorless""], ""convertedEnergyCost"": 2, ""damage"": ""20"", ""text"": """"}]",Pound|Surf,10|20,|,Lightning:+10,,Colorless,,Hajime Kusajima,"A poor walker, it often falls down. However, its strong pride makes it puff up its chest without a care.",,,,,,,,,,,,,,,,,,,,,,,,,
121.jpg,pl3-122,Rhyhorn,Pokémon,Fighting,Supreme Victors,122,Common,https://images.pokemontcg.io/pl3/122_hires.png,https://images.pokemontcg.io/pl3/122.png,70,,"[{""name"": ""Stomp"", ""cost"": [""Colorless"", ""Colorless""], ""convertedEnergyCost"": 2, ""damage"": ""10+"", ""text"": ""Flip a coin. If heads, this attack does 10 damage plus 20 more damage.""}, {""name"": ""Horn Drill"", ""cost"": [""Fighting"", ""Fighting"", ""Colorless""], ""convertedEnergyCost"": 3, ""damage"": ""50"", ""text"": """"}]",Stomp|Horn Drill,10+|50,"Flip a coin. If heads, this attack does 10 damage plus 20 more damage.|",Water:+10,Lightning:-20,Colorless__Colorless,,Tomokazu Komiya,"Its powerful tackles can destroy anything. However, it is too slow witted to help people work.",,,,,,,,,,,,,,,,,,,,,,,,,
122.jpg,pl3-123,Roselia,Pokémon,Grass,Supreme Victors,123,Common,https://images.pokemontcg.io/pl3/123_hires.png,https://images.pokemontcg.io/pl3/123.png,60,,"[{""name"": ""Vine Slap"", ""cost"": [""Colorless""], ""convertedEnergyCost"": 1, ""damage"": ""10"", ""text"": """"}, {""name"": ""Spit Poison"", ""cost"": [""Grass"", ""Colorless""], ""convertedEnergyCost"": 2, ""damage"": ""10"", ""text"": ""Flip a coin. If heads, the Defending Pokémon is now Poisoned.""}]",Vine Slap|Spit Poison,10|10,"|Flip a coin. If heads, the Defending Pokémon is now Poisoned.",Fire:+10,,Colorless,,Hajime Kusajima,"The more healthy the Roselia, the more pleasant its flowers' aroma. Its scent deeply relaxes people.",,,,,,,,,,,,,,,,,,,,,,,,,
123.jpg,pl3-124,Sandshrew,Pokémon,Fighting,Supreme Victors,124,Common,https://images.pokemontcg.io/pl3/124_hires.png,https://images.pokemontcg.io/pl3/124.png,50,,"[{""name"": ""Scratch"", ""cost"": [""Fighting""], ""convertedEnergyCost"": 1, ""damage"": ""20"", ""text"": """"}]",Scratch,20,,Water:+10,Lightning:-20,Colorless,,Suwama Chiaki,"To protect itself from attackers, it curls up into a ball. It lives in arid regions with minimal rainfall.",,,,,,,,,,,,,,,,,,,,,,,,,
124.jpg,pl3-125,Seel,Pokémon,Water,Supreme Victors,125,Common,https://images.pokemontcg.io/pl3/125_hires.png,https://images.pokemontcg.io/pl3/125.png,60,,"[{""name"": ""Tail Slap"", ""cost"": [""Colorless""], ""convertedEnergyCost"": 1, ""damage"": ""10"", ""text"": """"}, {""name"": ""Icy Wind"", ""cost"": [""Water"", ""Colorless""], ""convertedEnergyCost"": 2, ""damage"": ""20"", ""text"": ""Flip a coin. If heads, the Defending Pokémon is now Asleep.""}]",Tail Slap|Icy Wind,10|20,"|Flip a coin. If heads, the Defending Pokémon is now Asleep.",Metal:+10,,Colorless__Colorless,,Atsuko Nishida,A Pokémon that lives on icebergs. It swims in the sea using the point on its head to break up ice.,,,,,,,,,,,,,,,,,,,,,,,,,
125.jpg,pl3-126,Shinx,Pokémon,Lightning,Supreme Victors,126,Common,https://images.pokemontcg.io/pl3/126_hires.png,https://images.pokemontcg.io/pl3/126.png,60,,"[{""name"": ""Bite"", ""cost"": [""Lightning"", ""Colorless""], ""convertedEnergyCost"": 2, ""damage"": ""20"", ""text"": """"}]",Bite,20,,Fighting:+10,Metal:-20,Colorless,,Kouki Saitou,The extension and contraction of its muscles generates electricity. It glows when in trouble.,,,,,,,,,,,,,,,,,,,,,,,,,
126.jpg,pl3-127,Shroomish,Pokémon,Grass,Supreme Victors,127,Common,https://images.pokemontcg.io/pl3/127_hires.png,https://images.pokemontcg.io/pl3/127.png,60,,"[{""name"": ""Stun Spore"", ""cost"": [""Colorless""], ""convertedEnergyCost"": 1, ""damage"": """", ""text"": ""Flip a coin. If heads, the Defending Pokémon is now Paralyzed.""}, {""name"": ""Tackle"", ""cost"": [""Colorless"", ""Colorless""], ""convertedEnergyCost"": 2, ""damage"": ""20"", ""text"": """"}]",Stun Spore|Tackle,|20,"Flip a coin. If heads, the Defending Pokémon is now Paralyzed.|",Fire:+10,Water:-20,Colorless,,Yuka Morii,It spouts poison spores from the top of its head. These spores cause pain all over if inhaled.,,,,,,,,,,,,,,,,,,,,,,,,,
127.jpg,pl3-128,Skorupi,Pokémon,Psychic,Supreme Victors,128,Common,https://images.pokemontcg.io/pl3/128_hires.png,https://images.pokemontcg.io/pl3/128.png,50,,"[{""name"": ""Poison Sting"", ""cost"": [""Psychic"", ""Colorless""], ""convertedEnergyCost"": 2, ""damage"": ""10"", ""text"": ""Flip a coin. If heads, the Defending Pokémon is now Poisoned.""}, {""name"": ""Tail Smash"", ""cost"": [""Psychic"", ""Colorless"", ""Colorless""], ""convertedEnergyCost"": 3, ""damage"": ""40"", ""text"": ""Flip a coin. If tails, this attack does nothing.""}]",Poison Sting|Tail Smash,10|40,"Flip a coin. If heads, the Defending Pokémon is now Poisoned.|Flip a coin. If tails, this attack does nothing.",Psychic:+10,,Colorless__Colorless,,Hajime Kusajima,"As soon as the tail claws close, its needle tips secrete poison. It can survive a year without food.",,,,,,,,,,,,,,,,,,,,,,,,,
128.jpg,pl3-129,Starly,Pokémon,Colorless,Supreme Victors,129,Common,https://images.pokemontcg.io/pl3/129_hires.png,https://images.pokemontcg.io/pl3/129.png,50,,"[{""name"": ""Peck"", ""cost"": [""Colorless"", ""Colorless""], ""convertedEnergyCost"": 2, ""damage"": ""20"", ""text"": """"}]",Peck,20,,Lightning:+10,Fighting:-20,Colorless,,Mitsuhiro Arita,"Because they are weak individually, they form groups. However, they bicker if the group grows too big.",,,,,,,,,,,,,,,,,,,,,,,,,
129.jpg,pl3-130,Surskit,Pokémon,Grass,Supreme Victors,130,Common,https://images.pokemontcg.io/pl3/130_hires.png,https://images.pokemontcg.io/pl3/130.png,50,,"[{""name"": ""Quick Attack"", ""cost"": [""Colorless""], ""convertedEnergyCost"": 1, ""damage"": ""10+"", ""text"": ""Flip a coin. If heads, this attack does 10 damage plus 10 more damage.""}]",Quick Attack,10+,"Flip a coin. If heads, this attack does 10 damage plus 10 more damage.",Fire:+10,,Colorless,,Miki Tanaka,It appears as if it is skating on water. It draws prey with a sweet scent from the tip of its head.,,,,,,,,,,,,,,,,,,,,,,,,,
130.jpg,pl3-131,Turtwig,Pokémon,Grass,Supreme Victors,131,Common,https://images.pokemontcg.io/pl3/131_hires.png,https://images.pokemontcg.io/pl3/131.png,60,,"[{""name"": ""Shell Attack"", ""cost"": [""Colorless""], ""convertedEnergyCost"": 1, ""damage"": ""10"", ""text"": """"}, {""name"": ""Stomp"", ""cost"": [""Grass"", ""Colorless"", ""Colorless""], ""convertedEnergyCost"": 3, ""damage"": ""20+"", ""text"": ""Flip a coin. If heads, this attack does 20 damage plus 10 more damage.""}]",Shell Attack|Stomp,10|20+,"|Flip a coin. If heads, this attack does 20 damage plus 10 more damage.",Fire:+10,Water:-20,Colorless__Colorless,,Atsuko Nishida,"The shell on its back is made of soil. On a very healthy Turtwig, the shell should feel moist.",,,,,,,,,,,,,,,,,,,,,,,,,
131.jpg,pl3-132,Whismur,Pokémon,Colorless,Supreme Victors,132,Common,https://images.pokemontcg.io/pl3/132_hires.png,https://images.pokemontcg.io/pl3/132.png,60,,"[{""name"": ""Tone-Deaf"", ""cost"": [""Colorless""], ""convertedEnergyCost"": 1, ""damage"": """", ""text"": ""Flip a coin. If heads, the Defending Pokémon is now Confused.""}, {""name"": ""Rollout"", ""cost"": [""Colorless"", ""Colorless""], ""convertedEnergyCost"": 2, ""damage"": ""20"", ""text"": """"}]",Tone-Deaf|Rollout,|20,"Flip a coin. If heads, the Defending Pokémon is now Confused.|",Fighting:+10,,Colorless,,Yuka Morii,"Usually, its cries are like quiet murmurs. If frightened, it shrieks at the same volume as a jet plane.",,,,,,,,,,,,,,,,,,,,,,,,,
132.jpg,pl3-133,Zubat,Pokémon,Psychic,Supreme Victors,133,Common,https://images.pokemontcg.io/pl3/133_hires.png,https://images.pokemontcg.io/pl3/133.png,50,,"[{""name"": ""Quick Turn"", ""cost"": [""Colorless""], ""convertedEnergyCost"": 1, ""damage"": ""10×"", ""text"": ""Flip 2 coins. This attack does 10 damage times the number of heads.""}]",Quick Turn,10×,Flip 2 coins. This attack does 10 damage times the number of heads.,Psychic:+10,Fighting:-20,Colorless,,Masakazu Fukuda,It checks its surroundings and location using reflections of the ultrasonic waves from its mouth.,,,,,,,,,,,,,,,,,,,,,,,,,
133.jpg,pl3-134,Battle Tower,Trainer,,Supreme Victors,134,Uncommon,https://images.pokemontcg.io/pl3/134_hires.png,https://images.pokemontcg.io/pl3/134.png,,,,,,,,,,,Wataru Kawahara,,,,,,,,,,,,,,,,,,,,,,,,,,
134.jpg,pl3-135,Champion's Room,Trainer,,Supreme Victors,135,Uncommon,https://images.pokemontcg.io/pl3/135_hires.png,https://images.pokemontcg.io/pl3/135.png,,,,,,,,,,,Yusuke Ishikawa,,,,,,,,,,,,,,,,,,,,,,,,,,
135.jpg,pl3-136,Cynthia's Guidance,Trainer,,Supreme Victors,136,Uncommon,https://images.pokemontcg.io/pl3/136_hires.png,https://images.pokemontcg.io/pl3/136.png,,,,,,,,,,,Ken Sugimori,,,,,,,,,,,,,,,,,,,,,,,,,,
136.jpg,pl3-137,Cyrus's Initiative,Trainer,,Supreme Victors,137,Uncommon,https://images.pokemontcg.io/pl3/137_hires.png,https://images.pokemontcg.io/pl3/137.png,,,,,,,,,,,Ken Sugimori,,,,,,,,,,,,,,,,,,,,,,,,,,
137.jpg,pl3-138,Night Teleporter,Trainer,,Supreme Victors,138,Uncommon,https://images.pokemontcg.io/pl3/138_hires.png,https://images.pokemontcg.io/pl3/138.png,,,,,,,,,,,Ryota Saito,,,,,,,,,,,,,,,,,,,,,,,,,,
138.jpg,pl3-139,Palmer's Contribution,Trainer,,Supreme Victors,139,Uncommon,https://images.pokemontcg.io/pl3/139_hires.png,https://images.pokemontcg.io/pl3/139.png,,,,,,,,,,,Ken Sugimori,,,,,,,,,,,,,,,,,,,,,,,,,,
139.jpg,pl3-140,VS Seeker,Trainer,,Supreme Victors,140,Uncommon,https://images.pokemontcg.io/pl3/140_hires.png,https://images.pokemontcg.io/pl3/140.png,,,,,,,,,,,Wataru Kawahara,,,,,,,,,,,,,,,,,,,,,,,,,,
140.jpg,pl3-141,Absol G LV.X,Pokémon,Darkness,Supreme Victors,141,Rare Holo LV.X,https://images.pokemontcg.io/pl3/141_hires.png,https://images.pokemontcg.io/pl3/141.png,100,"[{""name"": ""Darkness Send"", ""text"": ""Once during your turn (before your attack), when you put Absol G LV.X from your hand onto your Active Absol G, you may flip 3 coins. For each heads, put the top card from your opponent's deck in the Lost Zone."", ""type"": ""Poké-Power""}]","[{""name"": ""Darkness Slugger"", ""cost"": [""Darkness"", ""Colorless""], ""convertedEnergyCost"": 2, ""damage"": ""30+"", ""text"": ""You may discard a card from your hand. If you do, this attack does 30 damage plus 30 more damage.""}]",Darkness Slugger,30+,"You may discard a card from your hand. If you do, this attack does 30 damage plus 30 more damage.",Fighting:×2,Psychic:-20,Colorless,Absol G,Yusuke Ishikawa,,,,,,,,,,,,,,,,,,,,,,,,,,
141.jpg,pl3-142,Blaziken FB LV.X,Pokémon,Fire,Supreme Victors,142,Rare Holo LV.X,https://images.pokemontcg.io/pl3/142_hires.png,https://images.pokemontcg.io/pl3/142.png,110,"[{""name"": ""Burning Spirit"", ""text"": ""Any damage done by attacks to a Burned Pokémon (both yours and your opponent's) is increased by 40 (after applying Weakness and Resistance). No more than 40 damage can be added by all Burning Spirit Poké-Bodies."", ""type"": ""Poké-Body""}]","[{""name"": ""Jet Shoot"", ""cost"": [""Fire"", ""Colorless""], ""convertedEnergyCost"": 2, ""damage"": ""80"", ""text"": ""During your opponent's next turn, any damage done to Blaziken FB by attacks is increased by 40 (after applying Weakness and Resistance).""}]",Jet Shoot,80,"During your opponent's next turn, any damage done to Blaziken FB by attacks is increased by 40 (after applying Weakness and Resistance).",Water:×2,,Colorless,Blaziken FB,Ryo Ueda,,,,,,,,,,,,,,,,,,,,,,,,,,
142.jpg,pl3-143,Charizard G LV.X,Pokémon,Fire,Supreme Victors,143,Rare Holo LV.X,https://images.pokemontcg.io/pl3/143_hires.png,https://images.pokemontcg.io/pl3/143.png,120,"[{""name"": ""Call for Power"", ""text"": ""As often as you like during your turn (before your attack), you may move an Energy attached to 1 of your Pokémon to Charizard G. This power can't be used if Charizard G is affected by a Special Condition."", ""type"": ""Poké-Power""}]","[{""name"": ""Malevolent Fire"", ""cost"": [""Fire"", ""Fire"", ""Colorless"", ""Colorless"", ""Colorless""], ""convertedEnergyCost"": 5, ""damage"": ""150"", ""text"": ""Flip a coin. If tails, discard all Energy attached to Charizard G.""}]",Malevolent Fire,150,"Flip a coin. If tails, discard all Energy attached to Charizard G.",Water:×2,Fighting:-20,Colorless__Colorless__Colorless,Charizard G,Wataru Kawahara,,,,,,,,,,,,,,,,,,,,,,,,,,
143.jpg,pl3-144,Electivire FB LV.X,Pokémon,Lightning,Supreme Victors,144,Rare Holo LV.X,https://images.pokemontcg.io/pl3/144_hires.png,https://images.pokemontcg.io/pl3/144.png,120,"[{""name"": ""Energy Recycle"", ""text"": ""Once during your turn (before your attack), you may use this power. If you do, your turn ends. Search your discard pile for up to 3 Energy cards and attach them to your Pokémon in any way you like. This power can't be used if Electivire FB is affected by a Special Condition."", ""type"": ""Poké-Power""}]","[{""name"": ""Powerful Spark"", ""cost"": [""Lightning"", ""Colorless"", ""Colorless""], ""convertedEnergyCost"": 3, ""damage"": ""30+"", ""text"": ""This attack does 30 damage plus 10 more damage for each Energy attached to all of your Pokémon.""}]",Powerful Spark,30+,This attack does 30 damage plus 10 more damage for each Energy attached to all of your Pokémon.,Fighting:×2,Metal:-20,Colorless__Colorless__Colorless,Electivire FB,Ryo Ueda,,,,,,,,,,,,,,,,,,,,,,,,,,
144.jpg,pl3-145,Garchomp C LV.X,Pokémon,Colorless,Supreme Victors,145,Rare Holo LV.X,https://images.pokemontcg.io/pl3/145_hires.png,https://images.pokemontcg.io/pl3/145.png,110,"[{""name"": ""Healing Breath"", ""text"": ""Once during your turn (before your attack), when you put Garchomp C LV.X from your hand onto your Active Garchomp C, you may remove all damage counters from each of your Pokémon SP."", ""type"": ""Poké-Power""}]","[{""name"": ""Dragon Rush"", ""cost"": [""Colorless"", ""Colorless"", ""Colorless""], ""convertedEnergyCost"": 3, ""damage"": """", ""text"": ""Discard 2 Energy attached to Garchomp C. Choose 1 of your opponent's Pokémon. This attack does 80 damage to that Pokémon. (Don't apply Weakness and Resistance for Benched Pokémon.) Garchomp C can't use Dragon Rush during your next turn.""}]",Dragon Rush,,Discard 2 Energy attached to Garchomp C. Choose 1 of your opponent's Pokémon. This attack does 80 damage to that Pokémon. (Don't apply Weakness and Resistance for Benched Pokémon.) Garchomp C can't use Dragon Rush during your next turn.,Colorless:×2,,,Garchomp C,Shizurow,,,,,,,,,,,,,,,,,,,,,,,,,,
145.jpg,pl3-146,Rayquaza C LV.X,Pokémon,Colorless,Supreme Victors,146,Rare Holo LV.X,https://images.pokemontcg.io/pl3/146_hires.png,https://images.pokemontcg.io/pl3/146.png,120,"[{""name"": ""Dragon Spirit"", ""text"": ""If Rayquaza C is your Active Pokémon and is damaged but not Knocked Out by an opponent's attack, you may search your discard pile for an Energy card and attach it to Rayquaza C."", ""type"": ""Poké-Body""}]","[{""name"": ""Final Blowup"", ""cost"": [""Water"", ""Psychic"", ""Fighting"", ""Colorless""], ""convertedEnergyCost"": 4, ""damage"": ""200"", ""text"": ""Discard all Energy attached to Rayquaza C. Ignore this effect if you have no cards in your hand.""}]",Final Blowup,200,Discard all Energy attached to Rayquaza C. Ignore this effect if you have no cards in your hand.,Colorless:×2,Fighting:-20,Colorless__Colorless__Colorless,Rayquaza C,Shizurow,,,,,,,,,,,,,,,,,,,,,,,,,,
